"Authors","Author full names","Author(s) ID","Title","Year","Source title","Volume","Issue","Art. No.","Page start","Page end","Page count","Cited by","Link","Abstract","Author Keywords","Index Keywords","References","EID"
"Lettieri G.; Handjaras G.; Ricciardi E.; Leo A.; Papale P.; Betta M.; Pietrini P.; Cecchetti L.","Lettieri, Giada (56680972900); Handjaras, Giacomo (35748302500); Ricciardi, Emiliano (8565770200); Leo, Andrea (55311312500); Papale, Paolo (57190440455); Betta, Monica (55904308300); Pietrini, Pietro (7005057128); Cecchetti, Luca (56625136900)","56680972900; 35748302500; 8565770200; 55311312500; 57190440455; 55904308300; 7005057128; 56625136900","Emotionotopy in the human right temporo-parietal cortex","2019","Nature Communications","10","1","5568","","","","44","https://www.scopus.com/inward/record.uri?eid=2-s2.0-85076019102&doi=10.1038%2fs41467-019-13599-z&partnerID=40&md5=723e0ef377b3955046e633be15effb6c","Humans use emotions to decipher complex cascades of internal events. However, which mechanisms link descriptions of affective states to brain activity is unclear, with evidence supporting either local or distributed processing. A biologically favorable alternative is provided by the notion of gradient, which postulates the isomorphism between functional representations of stimulus features and cortical distance. Here, we use fMRI activity evoked by an emotionally charged movie and continuous ratings of the perceived emotion intensity to reveal the topographic organization of affective states. Results show that three orthogonal and spatially overlapping gradients encode the polarity, complexity and intensity of emotional experiences in right temporo-parietal territories. The spatial arrangement of these gradients allows the brain to map a variety of affective states within a single patch of cortex. As this organization resembles how sensory regions represent psychophysical properties (e.g., retinotopy), we propose emotionotopy as a principle of emotion coding. © 2019, The Author(s).","","Adult; Attention; Brain; Brain Mapping; Emotions; Female; Humans; Magnetic Resonance Imaging; Male; Parietal Lobe; Photic Stimulation; Young Adult; brain; complexity; digital map; neurology; physiological response; spatial analysis; ambivalence; anger; Article; behavior assessment; BOLD signal; brain mapping; cell polarity; disgust; electroencephalogram; emotion; emotionality; emotionotopy; fear; Fourier transform; functional connectivity; functional magnetic resonance imaging; happiness; hemodynamics; human; nerve stimulation; psychophysiology; sadness; social cognition; spectroscopy; superior temporal sulcus; temporoparietal junction; topography; adult; anatomy and histology; attention; brain; diagnostic imaging; female; male; nuclear magnetic resonance imaging; parietal lobe; photostimulation; physiology; procedures; young adult","Panksepp J., Toward a general psychobiological theory of emotions, Behav. Brain Sci., 5, pp. 407-422, (1982); Kreibig S.D., Autonomic nervous system activity in emotion: a review, Biol. Psychol., 84, pp. 394-421, (2010); Stephens C.L., Christie I.C., Friedman B.H., Autonomic specificity of basic emotions: evidence from pattern classification and cluster analysis, Biol. Psychol., 84, pp. 463-473, (2010); Nummenmaa L., Glerean E., Hari R., Hietanen J.K., Bodily maps of emotions, Proc. Natl Acad. Sci. USA, 111, pp. 646-651, (2014); Ekman P., An argument for basic emotions, Cogn. Emot., 6, pp. 169-200, (1992); Tracy J.L., Randles D., Four models of basic emotions: a review of Ekman and Cordaro, Izard, Levenson, and Panksepp and Watt, Emot. Rev., 3, pp. 397-405, (2011); Vytal K., Hamann S., Neuroimaging support for discrete neural correlates of basic emotions: a voxel-based meta-analysis, J. Cogn. Neurosci., 22, pp. 2864-2885, (2010); Saarimaki H., Et al., Discrete neural signatures of basic emotions, Cereb. Cortex, 26, pp. 2563-2573, (2015); Peelen M.V., Atkinson A.P., Vuilleumier P., Supramodal representations of perceived emotions in the human brain, J. Neurosci., 30, pp. 10127-10134, (2010); Kragel P.A., LaBar K.S., Multivariate neural biomarkers of emotional states are categorically distinct, Soc. Cogn. Affect. Neurosci., 10, pp. 1437-1448, (2015); Lindquist K.A., Wager T.D., Kober H., Bliss-Moreau E., Barrett L.F., The brain basis of emotion: a meta-analytic review, Behav. Brain Sci., 35, pp. 121-143, (2012); Kober H., Et al., Functional grouping and cortical–subcortical interactions in emotion: a meta-analysis of neuroimaging studies, Neuroimage, 42, pp. 998-1031, (2008); Touroutoglou A., Lindquist K.A., Dickerson B.C., Barrett L.F., Intrinsic connectivity in the human brain does not reveal networks for ‘basic’emotions, Soc. Cogn. Affect. Neurosci., 10, pp. 1257-1265, (2015); Russell J.A., A circumplex model of affect, J. Pers. Soc. Psychol., 39, (1980); Smith C.A., Ellsworth P.C., Patterns of cognitive appraisal in emotion, J. Pers. Soc. Psychol., 48, (1985); Mehrabian A., Russell J.A., An Approach to Environmental Psychology, (1974); Fontaine J.R., Scherer K.R., Roesch E.B., Ellsworth P.C., The world of emotions is not two-dimensional, Psychol. Sci., 18, pp. 1050-1057, (2007); Anderson A.K., Et al., Dissociated neural representations of intensity and valence in human olfaction, Nat. Neurosci., 6, (2003); Wager T.D., Phan K.L., Liberzon I., Taylor S.F., Valence, gender, and lateralization of functional brain anatomy in emotion: a meta-analysis of findings from neuroimaging, Neuroimage, 19, pp. 513-531, (2003); Kassam K.S., Markey A.R., Cherkassky V.L., Loewenstein G., Just M.A., Identifying emotions on the basis of neural activation, PLoS ONE, 8, (2013); Lindquist K.A., Satpute A.B., Wager T.D., Weber J., Barrett L.F., The brain basis of positive and negative affect: evidence from a meta-analysis of the human neuroimaging literature, Cereb. Cortex, 26, pp. 1910-1922, (2015); Nummenmaa L., Et al., Emotions promote social interaction by synchronizing brain activity across individuals, Proc. Natl Acad. Sci. USA, 109, pp. 9599-9604, (2012); Mourao-Miranda J., Et al., Contributions of stimulus valence and arousal to visual activation during emotional perception, Neuroimage, 20, pp. 1955-1963, (2003); Kensinger E.A., Schacter D.L., Processing emotional pictures and words: effects of valence and arousal, Cogn. Affect. Behav. Neurosci., 6, pp. 110-126, (2006); Mather M., Et al., Emotional arousal can impair feature binding in working memory, J. Cogn. Neurosci., 18, pp. 614-625, (2006); Morelli S.A., Rameson L.T., Lieberman M.D., The neural components of empathy: predicting daily prosocial behavior, Soc. Cogn. Affect. Neurosci., 9, pp. 39-47, (2012); Morelli S.A., Lieberman M.D., The role of automaticity and attention in neural processes underlying empathy for happiness, sadness, and anxiety, Front. Hum. Neurosci., 7, (2013); Saxe R., Kanwisher N., People thinking about thinking people: the role of the temporo-parietal junction in “theory of mind, Neuroimage, 19, pp. 1835-1842, (2003); Skerry A.E., Saxe R., Neural representations of emotion are organized around abstract event features, Curr. Biol., 25, pp. 1945-1954, (2015); Barrett L.F., Wager T.D., The structure of emotion: evidence from neuroimaging studies, Curr. Dir. Psychol. Sci., 15, pp. 79-83, (2006); Saarimaki H., Et al., Distributed affective space represents multiple emotion categories across the human brain, Soc. Cogn. Affect. Neurosci., 13, pp. 471-482, (2018); Clark-Polner E., Johnson T.D., Barrett L.F., Multivoxel pattern analysis does not provide evidence to support the existence of basic emotions, Cereb. Cortex, 27, pp. 1944-1948, (2017); Wager T.D., Et al., A Bayesian model of category-specific emotional brain responses, PLoS Comput. Biol., 11, (2015); Sereno M.I., Et al., Borders of multiple visual areas in humans revealed by functional magnetic resonance imaging, Science, 268, pp. 889-893, (1995); Huth A.G., de Heer W.A., Griffiths T.L., Theunissen F.E., Gallant J.L., Natural speech reveals the semantic maps that tile human cerebral cortex, Nature, 532, (2016); Margulies D.S., Et al., Situating the default-mode network along a principal gradient of macroscale cortical organization, Proc. Natl Acad. Sci. USA, 113, pp. 12574-12579, (2016); Huntenburg J.M., Bazin P.L., Margulies D.S., Large-scale gradients in human cortical organization, Trends Cogn. Sci., 1, pp. 21-31, (2018); Sha L., Et al., The animacy continuum in the human ventral vision pathway, J. Cogn. Neurosci., 27, pp. 665-678, (2015); Harvey B.M., Klein B.P., Petridou N., Dumoulin S.O., Topographic representation of numerosity in the human parietal cortex, Science, 341, pp. 1123-1126, (2013); Hanke M., Et al., A studyforrest extension, simultaneous fMRI and eye gaze recordings during prolonged natural stimulation, Sci. Data, 3, (2016); Labs A., Reich T., Schulenburg H., Boennen M., Mareike G., Golz M., Hartigs B., Hoffmann N., Keil S., Perlow M., Peukmann A.K., Rabe L.N., von Sobbe F.-R., Hanke M., Portrayed emotions in the movie ""Forrest Gump, F1000Research, 4, (2015); Van Overwalle F., Social cognition and the brain: a meta‐analysis, Hum. Brain Mapp., 30, pp. 829-858, (2009); Dumoulin S.O., Wandell B.A., Population receptive field estimates in human visual cortex, Neuroimage, 39, pp. 647-660, (2008); Trampe D., Quoidbach J., Taquet M., Emotions in everyday life, PLoS ONE, 10, (2015); Thornton M.A., Tamir D.I., Mental models accurately predict emotion transitions, Proc. Natl Acad. Sci. USA, 114, pp. 5982-5987, (2017); Philippot P., Inducing and assessing differentiated emotion-feeling states in the laboratory, Cogn. Emot., 7, pp. 171-193, (1993); Gross J.J., Levenson R.W., Emotion elicitation using films, Cogn. Emot., 9, pp. 87-108, (1995); Schaefer A., Nils F., Sanchez X., Philippot P., Assessing the effectiveness of a large database of emotion-eliciting films: A new tool for emotion researchers, Cogn. Emot., 24, pp. 1153-1172, (2010); Smith M., Engaging Characters: Fiction, Emotion, and the Cinema, (1995); Lombardo M.V., Et al., Shared neural circuits for mentalizing about the self and others, J. Cogn. Neurosci., 22, pp. 1623-1635, (2010); Raz G., Et al., Cry for her or cry with her: context-dependent dissociation of two modes of cinematic empathy reflected in network cohesion dynamics, Soc. Cogn. Affect. Neurosci., 9, pp. 30-38, (2013); Mesquita B., Walker R., Cultural differences in emotions: a context for interpreting emotional experiences, Behav. Res. Ther., 41, pp. 777-793, (2003); Lindquist K.A., Barrett L.F., A functional architecture of the human brain: emerging insights from the science of emotion, Trends Cogn. Sci., 16, pp. 533-540, (2012); Cowen A.S., Keltner D., Self-report captures 27 distinct categories of emotion bridged by continuous gradients, Proc. Natl Acad. Sci. USA, 114, pp. E7900-E7909, (2017); Larsen J.T., McGraw A.P., Cacioppo J.T., Can people feel happy and sad at the same time?, J. Pers. Soc. Psychol., 81, (2001); Berrios R., Totterdell P., Kellett S., Eliciting mixed emotions: a meta-analysis comparing models, types, and measures, Front. Psychol., 6, (2015); Adolphs R., The biology of fear, Curr. Biol., 23, pp. R79-R93, (2013); Russell J.A., Mixed emotions viewed from the psychological constructionist perspective, Emot. Rev., 9, pp. 111-117, (2017); Mitchell R.L., Phillips L.H., The overlapping relationship between emotion perception and theory of mind, Neuropsychologia, 70, pp. 1-10, (2015); Donaldson P.H., Rinehart N.J., Enticott P.G., Noninvasive stimulation of the temporoparietal junction: a systematic review, Neurosci. Biobehav. Rev., 55, pp. 547-572, (2015); Campanella F., Shallice T., Ius T., Fabbro F., Skrap M., Impact of brain tumour location on emotion and personality: a voxel-based lesion–symptom mapping study on mentalization processes, Brain, 137, pp. 2532-2545, (2014); Kragel P.A., LaBar K.S., Decoding the nature of emotion in the brain, Trends Cogn. Sci., 20, pp. 444-455, (2016); Burnett S., Blakemore S.J., Functional connectivity during a social emotion task in adolescents and in adults, Eur. J. Neurosci., 29, pp. 1294-1301, (2009); Kleiner M., Et al., What’s new in Psychtoolbox-3, Perception, 36, (2007); Schreiber T., Schmitz A., Improved surrogate data for nonlinearity tests, Phys. Rev. Lett., 77, pp. 635-638, (1996); Maaten L.V.D., Hinton G., Visualizing data using t-SNE, J. Mach. Learn. Res., 9, pp. 2579-2605, (2008); Rousseeuw P.J., Kaufman L., Finding Groups in Data, (1990); Naselaris T., Kay K.N., Nishimoto S., Gallant J.L., Encoding and decoding in fMRI, Neuroimage, 56, pp. 400-410, (2011); Handjaras G., Et al., Modality-independent encoding of individual concepts in the left parietal cortex, Neuropsychologia, 105, pp. 39-49, (2017); Benjamini Y., Hochberg Y., Controlling the False Discovery Rate: a practical and powerful approach to multiple testing, J. R. Stat. Soc. B, 57, pp. 289-300, (1995); Ejaz N., Hamada M., Diedrichsen J., Hand use predicts the structure of representations in sensorimotor cortex, Nat. Neurosci., 18, (2015); Leo A., Et al., A synergy-based hand control is encoded in human motor cortical areas, Elife, 5, (2016); Kriegeskorte N., Simmons W.K., Bellgowan P.S., Baker C.I., Circular analysis in systems neuroscience: the dangers of double dipping, Nat. Neurosci., 12, (2009); Yarkoni T., Poldrack R.A., Nichols T.E., Van Essen D.C., Wager T.D., Large-scale automated synthesis of human functional neuroimaging data, Nat. Methods, 8, (2011); Yarrow S., Razak K.A., Seitz A.R., Series P., Detecting and quantifying topography in neural maps, PLoS ONE, 9, (2014); Reuter M., Schmansky N.J., Rosas H.D., Fischl B., Within-subject template estimation for unbiased longitudinal image analysis, Neuroimage, 61, pp. 1402-1418, (2012); Fonov V.S., Evans A.C., McKinstry R.C., Almli C.R., Collins D.L., Unbiased nonlinear average age-appropriate brain templates from birth to adulthood, Neuroimage, 47, (2009); Fischl B., Sereno M.I., Dale A.M., Cortical surface-based analysis: II: inflation, flattening, and a surface-based coordinate system, Neuroimage, 9, pp. 195-207, (1999); Van Essen D.C., Glasser M.F., Dierker D.L., Harwell J., Coalson T., Parcellations and hemispheric asymmetries of human cerebral cortex analyzed on surface-based atlases, Cereb. Cortex, 22, pp. 2241-2262, (2011); Ortony A., Clore G.L., Collins A., The Cognitive Structure of Emotions, (1990); Bilenko N.Y., Gallant J.L., Pyrcca: regularized kernel canonical correlation analysis in python and its applications to neuroimaging, Front. Neuroinform., 10, (2016); Haak K.V., Marquand A.F., Beckmann C.F., Connectopic mapping with resting-state fMRI, Neuroimage, 170, pp. 83-94, (2017); Glasser M.F., Et al., A multi-modal parcellation of human cerebral cortex, Nature, 536, pp. 171-178, (2016); Lee D.D., Seung H.S., Learning the parts of objects by non-negative matrix factorization, Nature, 401, (1999)","2-s2.0-85076019102"
"Laurino M.; Stano M.; Betta M.; Pannocchia G.; Landi A.","Laurino, Marco (23135421400); Stano, Maurizio (55903013200); Betta, Monica (55904308300); Pannocchia, Gabriele (6603482876); Landi, Alberto (7005259629)","23135421400; 55903013200; 55904308300; 6603482876; 7005259629","Combining pharmacological therapy and vaccination in Chronic Myeloid Leukemia via model predictive control","2013","Proceedings of the Annual International Conference of the IEEE Engineering in Medicine and Biology Society, EMBS","","","6610403","3925","3928","3","2","https://www.scopus.com/inward/record.uri?eid=2-s2.0-84886479370&doi=10.1109%2fEMBC.2013.6610403&partnerID=40&md5=f56c3f6ec02b370397045e6d5c0cf8a7","This paper describes a simulation study which aims at optimizing the therapy for the control of Chronic Myeloid Leukemia according to the following objectives: the reduction of the administered drug and vaccine amounts, the establishment of a auto-immune response and the long-term control of disease without reducing the effective of therapy with respect to the full treatment. A therapy optimization method is developed defining and solving a Model Predictive Control algorithm, preceded by an accurate Initial Guess search based on Monte-Carlo like approach. Simulation results show that the suggested procedure achieves the proposed goals. © 2013 IEEE.","","Algorithms; Cancer Vaccines; Computer Simulation; Humans; Leukemia, Myelogenous, Chronic, BCR-ABL Positive; Models, Biological; Monte Carlo Method; Vaccination; Algorithms; Diseases; Drug therapy; Model predictive control; Predictive control systems; Vaccines; cancer vaccine; Chronic myeloid leukemias; Initial guess; Optimization method; Search-based; Simulation studies; Via modeling; algorithm; biological model; computer simulation; human; immunology; Leukemia, Myelogenous, Chronic, BCR-ABL Positive; Monte Carlo method; vaccination; Disease control","Crews L., Jamieson C., Chronic myeloid leukemia stem cell biology, Curr Hematol Malig Rep., 2012, 7, 2, pp. 125-132, (2012); Faderl S., Talpaz M., Estrov Z., O'Brien S., Kurzrock R., Kantarjian H., The biology of chronic myeloid leukemia, N Engl J Med 1999, 341, pp. 164-172, (1999); Sawyers C., Chronic myeloid leukemia, N Engl J Med, 340, pp. 1330-1340, (2000); Angstreich G., Smith B., Jones R., Treatment options for chronic myeloid leukemia: Imatinib versus interferon versus allogeneic transplant, CurrOpin Oncol, 16, pp. 95-99, (2004); Smahel M., Antigens in chronic myeloid leukemia: Implications for vaccine development, Cancer Immunol Immunother. 2011, 60, 12, pp. 1655-1668, (2011); Michor F., Hughes T., Iwasa Y., Branford S., Shah N.P., Sawyers C., Nowak M., Dynamics of chronic myeloid leukaemia, Nature, 435, (2005); Roeder I., Horn M., Glauche I., Hochhaus A., Mueller M.C., Loeffler M., Dynamic modeling of imatinib-treated chronic myeloid leukemia: Functional insights and clinical implications, Nature Medicine, 12, (2006); Komarova N., Wodarz D., Drug resistance in cancer: Principles of emergence and prevention, Proc Natl Acad Sci USA, 102, pp. 9714-9719, (2005); Kim P., Lee P., Levy D., Dynamics and potential impact of the immune response to chronic myelogenous leukemia, PLoS Computational Biology, 4, 6, (2008); Pannocchia G., Brambilla A., Model predictive control for optimal oral anticoagulant drug administration, AIChE Journal, 52, 9, pp. 3315-3320, (2006); Pannocchia G., Laurino M., Landi A., A model predictive control strategy towards optimal structured treatment interruptions in anti-HIV therapy, IEEE Trans. Biom. Eng., 57, 5, pp. 1040-1050, (2010); Ionescu C., De Keyser R., Torrico B., De Smet T., Struys M., Normey-Rico J., Robust predictive control strategy applied for propofol dosing using bis as a controlled variable during anesthesia, Biomedical Engineering, IEEE Transactions on, 55, 9, pp. 2161-2170, (2008); Zurakowski R., Nonlinear observer output-feedback mpc treatment scheduling for hiv, BioMedical Engineering Online, 10, (2011); Pannocchia G., Rawlings J.B., Disturbance models for offset-free model predictive control, AIChE J., 49, pp. 426-437, (2003); Pannocchia G., Robust disturbance modeling for model predictive control with application to multivariable ill-conditioned processes, J. Proc. Cont., 13, pp. 693-701, (2003); Morari M., Maeder U., Nonlinear offset-free model predictive control, Automatica, 48, pp. 2059-2067, (2012)","2-s2.0-84886479370"
