doi,citedby_count,description,author_names,author_ids
10.1371/journal.pcbi.1002961,34,"Inference of interaction rules of animals moving in groups usually relies on an analysis of large scale system behaviour. Models are tuned through repeated simulation until they match the observed behaviour. More recent work has used the fine scale motions of animals to validate and fit the rules of interaction of animals in groups. Here, we use a Bayesian methodology to compare a variety of models to the collective motion of glass prawns (Paratya australiensis). We show that these exhibit a stereotypical 'phase transition', whereby an increase in density leads to the onset of collective motion in one direction. We fit models to this data, which range from: a mean-field model where all prawns interact globally; to a spatial Markovian model where prawns are self-propelled particles influenced only by the current positions and directions of their neighbours; up to non-Markovian models where prawns have 'memory' of previous interactions, integrating their experiences over time when deciding to change behaviour. We show that the mean-field model fits the large scale behaviour of the system, but does not capture the observed locality of interactions. Traditional self-propelled particle models fail to capture the fine scale dynamics of the system. The most sophisticated model, the non-Markovian model, provides a good match to the data at both the fine scale and in terms of reproducing global dynamics, while maintaining a biologically plausible perceptual range. We conclude that prawns' movements are influenced by not just the current direction of nearby conspecifics, but also those encountered in the recent past. Given the simplicity of prawns as a study system our research suggests that self-propelled particle models of collective motion should, if they are to be realistic at multiple biological scales, include memory of previous interactions and other non-Markovian effects. © 2013 Mann et al.","Mann, Richard P.;Perna, Andrea;Strömbom, Daniel;Garnett, Roman;Herbert-Read, James E.;Sumpter, David J.T.;Ward, Ashley J.W.",35248716800;16199989700;39863680000;34874855000;35726673000;6602893688;35579996400
10.1016/j.chaos.2012.11.003,12,"Networks and the associated tools from graph theory have now become well-established approaches to study natural as well as human-made systems. While early studies focused on topology and connectivity, the recent literature has acknowledged the importance of the dynamical properties of these networks. Here we focus on such a dynamic measure: accessibility. It characterizes for any given movement dynamics (such as random walks) the average number of nodes that can be reached in exactly h steps (out-accessibility), or the average number of nodes from which a given node can be reached (in-accessibility). This focus on dynamics makes accessibility particularly appropriate to study movement on networks and to detect complementary properties with respect to topology-based measurements such as betweenness centrality. We apply this measure to six nests of Cubitermes termites. Their mushroom-like 3D architectures consist of chambers and connecting tunnels that can be associated to nodes and edges in a communication network. Accessibilities turn out to be particularly low in the bottom part of the nests that link them to their underground tunneling network. We interpret this result in the context of anti-predator (ants) behavior and/or as a side effect of the global nest shape.","Viana, Matheus P.;Fourcassié, Vincent;Perna, Andrea;Costa, Luciano da F.;Jost, Christian",7005844510;6603453140;16199989700;35582873300;7005169161
10.1063/1.3703655,0,"We will deonstrate the use of (more or less!) Bayesian methods for inferring interaction rules between individuals in a system of collective animal motion. We examine a group of prawns moving in an effectively one-dimensional environment, which we reduce to a binary classification problem, aiming to infer the factors that predict whether an individual will change its direction of motion. Our results show that interactions are primarily driven by spatial proximity, that prawns tend to align with other individuals travelling in the opposite direction and that the effect of interactions persist over time to create a non-Markovian system. This extended introduction provides technical details of the models we examine and some preliminary findings. The full results of this analysis will be published when complete. © 2012 American Institute of Physics.","Mann, Richard P.;Perna, Andrea;Strömbom, Daniel;Sumpter, David J.T.;Garnett, Roman;Herbert-Read, James E.;Ward, Ashley J.W.",35248716800;16199989700;39863680000;6602893688;34874855000;35726673000;35579996400
10.1098/rsfs.2012.0031,62,"Collective animal behaviour is the study of how interactions between individuals produce group level patterns, and why these interactions have evolved. This study has proved itself uniquely interdisciplinary, involving physicists, mathematicians, engineers as well as biologists. Almost all experimental work in this area is related directly or indirectly to mathematical models, with regular movement back and forth between models, experimental data and statistical fitting. In this paper, we describe how the modelling cycle works in the study of collective animal behaviour. We classify studies as addressing questions at different levels or linking different levels, i.e. as local, local to global, global to local or global. We also describe three distinct approaches-theory-driven, data-driven and model selection-to these questions. We show, with reference to our own research on species across different taxa, how we move between these different levels of description and how these various approaches can be applied to link levels together. © 2012 The Royal Society.","Sumpter, David J.T.;Mann, Richard P.;Perna, Andrea",6602893688;35248716800;16199989700
10.1371/journal.pcbi.1002592,84,"We studied the formation of trail patterns by Argentine ants exploring an empty arena. Using a novel imaging and analysis technique we estimated pheromone concentrations at all spatial positions in the experimental arena and at different times. Then we derived the response function of individual ants to pheromone concentrations by looking at correlations between concentrations and changes in speed or direction of the ants. Ants were found to turn in response to local pheromone concentrations, while their speed was largely unaffected by these concentrations. Ants did not integrate pheromone concentrations over time, with the concentration of pheromone in a 1 cm radius in front of the ant determining the turning angle. The response to pheromone was found to follow a Weber's Law, such that the difference between quantities of pheromone on the two sides of the ant divided by their sum determines the magnitude of the turning angle. This proportional response is in apparent contradiction with the well-established non-linear choice function used in the literature to model the results of binary bridge experiments in ant colonies (Deneubourg et al. 1990). However, agent based simulations implementing the Weber's Law response function led to the formation of trails and reproduced results reported in the literature. We show analytically that a sigmoidal response, analogous to that in the classical Deneubourg model for collective decision making, can be derived from the individual Weber-type response to pheromone concentrations that we have established in our experiments when directional noise around the preferred direction of movement of the ants is assumed. © 2012 Perna et al.","Perna, Andrea;Granovskiy, Boris;Garnier, Simon;Nicolis, Stamatios C.;Labédan, Marjorie;Theraulaz, Guy;Fourcassié, Vincent;Sumpter, David J.T.",16199989700;55178546300;13006090300;7004595221;55327700300;7004591018;6603453140;6602893688
10.1371/journal.pcbi.1002308,12,"Inference of interaction rules of animals moving in groups usually relies on an analysis of large scale system behaviour. Models are tuned through repeated simulation until they match the observed behaviour. More recent work has used the fine scale motions of animals to validate and fit the rules of interaction of animals in groups. Here, we use a Bayesian methodology to compare a variety of models to the collective motion of glass prawns (Paratya australiensis). We show that these exhibit a stereotypical 'phase transition', whereby an increase in density leads to the onset of collective motion in one direction. We fit models to this data, which range from: a mean-field model where all prawns interact globally; to a spatial Markovian model where prawns are self-propelled particles influenced only by the current positions and directions of their neighbours; up to non-Markovian models where prawns have 'memory' of previous interactions, integrating their experiences over time when deciding to change behaviour. We show that the mean-field model fits the large scale behaviour of the system, but does not capture fine scale rules of interaction, which are primarily mediated by physical contact. Conversely, the Markovian self-propelled particle model captures the fine scale rules of interaction but fails to reproduce global dynamics. The most sophisticated model, the non-Markovian model, provides a good match to the data at both the fine scale and in terms of reproducing global dynamics. We conclude that prawns' movements are influenced by not just the current direction of nearby conspecifics, but also those encountered in the recent past. Given the simplicity of prawns as a study system our research suggests that self-propelled particle models of collective motion should, if they are to be realistic at multiple biological scales, include memory of previous interactions and other non-Markovian effects. © 2012 Mann et al.","Mann, Richard P.;Perna, Andrea;Strömbom, Daniel;Garnett, Roman;Herbert-Read, James E.;Sumpter, David J.T.;Ward, Ashley J.W.",35248716800;16199989700;39863680000;34874855000;35726673000;6602893688;35579996400
10.4018/978-1-61350-092-7.ch007,5,"Social insect colonies build large net-like systems: gallery and trail networks. Many such networks appear to show near-optimal performance. Focusing on the network system inside termite nests we address the question how simple agents with probabilistic behaviour can control and optimize the growth of a structure with size several magnitude orders above their perceptual range. We identify two major classes of mechanisms: (i) purely local mechanisms, which involve the arrangement of simple motifs according to predetermined rules of behaviour and (ii) local estimation of global quantities, where sizes, lengths, and numbers are estimated from densities, concentrations, and traffic. Theoretical considerations suggest that purely local mechanisms work better during early network formation and are less likely to fall into local optima. On the contrary, estimation of global properties is only possible on functional networks and is more likely to work through pruning. This latter mechanism may contribute to restore network functionalities following unpredicted changes of external conditions or network topology. An analysis of the network properties of Cubitermes termite nests supports the role of both classes of mechanisms, possibly in interplay with environmental conditions acting as a template. © 2012, IGI Global.","Perna, Andrea;Kuntz, Pascale;Theraulaz, Guy;Jost, Christian",16199989700;7004843798;7004591018;7005169161
10.1073/pnas.1109355108,375,"Collective motion, where large numbers of individuals move synchronously together, is achieved when individuals adopt interaction rules that determine how they respond to their neighbors'movements and positions. These rules determine how group-living animals move, make decisions, and transmit information between individuals. Nonetheless, few studies have explicitly determined these interaction rules in moving groups, and very little is known about the interaction rules of fish. Here,we identify three key rules for the social interactions of mosquitofish (Gambusia holbrooki): (i) Attraction forces are important in maintaining group cohesion, while we find only weak evidence that fish align with their neighbor's orientation; (ii) repulsion is mediated principally by changes in speed; (iii) although the positions and directions of all shoal members are highly correlated, individuals only respond to their single nearest neighbor. The last two of these rules are different from the classical models of collective animal motion, raising new questions about how fish and other animals self-organize on the move.","Herbert-Read, James E.;Perna, Andrea;Mann, Richard P.;Schaerf, Timothy M.;Sumpter, David J.T.;Ward, Ashley J.W.",35726673000;16199989700;35248716800;36609205600;6602893688;35579996400
10.1103/PhysRevE.83.066106,24,"We propose a method for quantitative characterization of spatial networklike patterns with loops, such as surface fracture patterns, leaf vein networks, and patterns of urban streets. Such patterns are not well characterized by purely topological estimators: also patterns that both look different and result from different morphogenetic processes can have similar topology. A local geometric cue-the angles formed by the different branches at junctions-can complement topological information and allow the quantification of the large scale spatial coherence of the pattern. For patterns that grow over time, such as fracture lines on the surface of ceramics, the rank assigned by our method to each individual segment of the pattern approximates the order of appearance of that segment. We apply the method to various networklike patterns and find a continuous but sharp dichotomy between two classes of spatial networks: hierarchical and homogeneous. The former class results from a sequential growth process and presents large scale organization, and the latter presents local, but not global, organization. © 2011 American Physical Society.","Perna, Andrea;Kuntz, Pascale;Douady, Stéphane",16199989700;7004843798;6701806111
10.7551/978-0-262-29714-1-ch061,10,"The nests of social insects are not only impressive because of their sheer complexity, but also because they are built from much smaller agents whose work is not centrally coordinated. A central question is therefore how this coordination can lead to such large scale structures. In this paper we present an individual based nest construction model from experimentally inspired rules. The coordination of the building process is achieved through three main ingredients: 1) stigmergy, which implies that the local configuration of the structure is the stimulus which determines how to continue, 2) body template, where the interaction between the ant's body and the growing structure determines the proportions of the emerging pattern, and 3) a construction”pheromone”, a chemical compound capable of triggering building actions. Our simulations show that this simple set of coordination rules can reproduce the key features observed experimentally in the ant Lasius niger, notably the emergence of mushroom-like pillars and layered structures. A sensitivity analysis on the evaporation rate of the construction pheromone shows that a large range of architectures, from dynamic multilayered nests to compact sponge-like structures, can be produced with the same behavioural rules by simply modifying evaporation rate. We discuss the relevance of these results with respect to the variety of nest architectures found in social insects.","Khuong, Anaïs;Theraulaz, Guy;Jost, Christian;Perna, Andrea;Gautrais, Jacques",55670070600;7004591018;7005169161;16199989700;6506823391
10.1103/PhysRevE.79.066106,10,"Optimization has been shown to be a driving force for the evolution of some biological structures, such as neural maps in the brain or transport networks. Here we show that insect networks also display characteristic traits of optimality. By using a graph representation of the chamber organization of termite nests and a disordered lattice model, it is found that these spatial nests are close to a percolation threshold. This suggests that termites build efficient systems of galleries spanning most of the nest volume at low cost. The evolutionary consequences are outlined. © 2009 The American Physical Society.","Valverde, Sergi;Corominas-Murtra, Bernat;Perna, Andrea;Kuntz, Pascale;Theraulaz, Guy;Solé, Ricard V.",7006393703;23488700900;16199989700;7004843798;7004591018;7004381560
10.1167/8.10.15,20,"Human psychophysical observations, computational models, and the selectivity of neurons in primary visual cortex all suggest that an early step in visual processing is the detection of features such as lines and edges. However, previous fMRI experiments investigating the responses of early visual areas to phase coherence have led to apparently discordant results. We studied the human brain BOLD responses to structured periodic band-pass images of matched amplitude spectrum but of different phase spectra, arranged to create three distinct types of stimuli: pure edges; pure lines (matched global and local energy to the edges, but different phase); and random noise (random phase spectrum, hence no salient features, and a different spatial distribution of local energy from the lines and edges stimuli). Alternation of lines against edges did not activate primary visual cortex, but did activate two higher order visual areas. Alternation of these lines or edges against the random stimulus produced a strong activity in many visual areas, including primary visual cortex. Interestingly, the BOLD activity was higher for the edges and lines than for the random stimuli for a wide range of stimulus contrasts, indicating the presence of non-linear gain modulation in the cell response. These results show that phase congruency is coded at the level of primary visual cortex. We show that a stage of response gain modulation can explain our present and previous fMRI discordant results. © ARVO.","Perna, Andrea;Tosetti, Michela;Montanaro, Domenico;Morrone, Maria Concetta",16199989700;6701756843;36764310900;7004710787
10.1007/978-3-540-92191-2_15,13,"Termites are known for building some of the most elaborate architectures observed in the animal world. We here analyse some topological properties of three dimensional networks of galleries built by termites of the genus Cubitermes. These networks are extremely sparse, in spite of the fact that there is no building cost associated with higher connectivity. In addition, more ""central"" vertices (in term of betweenness or degree) are preferentially localised at spatial positions far from the external nest walls (more than in a null network model calibrated to exactly the same spatial arrangement of vertices). We argue that both sparseness and the particular spatial location of ""central"" vertices may be adaptive, because they provide an ecological advantage for nest defence against the attacks from other insects. © 2008 Springer Berlin Heidelberg.","Perna, Andrea;Jost, Christian;Valverde, Sergi;Gautrais, Jacques;Theraulaz, Guy;Kuntz, Pascale",16199989700;7005169161;7006393703;6506823391;7004591018;7004843798
10.1016/j.physa.2008.07.019,47,"Transport networks are a key component of human and natural societies that enable efficient communication at a low cost. Here, we study the topological efficiency of the three-dimensional networks of galleries in termite nests and how spatial constraints affect the organisation of these networks. Cubitermes termite nests have far better than random transportation efficiency, but they do not reach theoretical optimal performance. We rather suggest a multiobjective process where a number of additional requirements, such as resilience to external attacks and the presence of spatial constraints, limit the ability of the system to achieve maximal transportation performance. © 2008 Elsevier B.V. All rights reserved.","Perna, Andrea;Valverde, Sergi;Gautrais, Jacques;Jost, Christian;Solé, Ricard;Kuntz, Pascale;Theraulaz, Guy",16199989700;7006393703;6506823391;7005169161;7004381560;7004843798;7004591018
10.1007/s00114-008-0388-6,61,"Recent studies have introduced computer tomography (CT) as a tool for the visualisation and characterisation of insect architectures. Here, we use CT to map the three-dimensional networks of galleries inside Cubitermes nests in order to analyse them with tools from graph theory. The structure of these networks indicates that connections inside the nest are rearranged during the whole nest life. The functional analysis reveals that the final network topology represents an excellent compromise between efficient connectivity inside the nest and defence against attacking predators. We further discuss and illustrate the usefulness of CT to disentangle environmental and specific influences on nest architecture. © 2008 Springer-Verlag.","Perna, Andrea;Jost, Christian;Couturier, Etienne;Valverde, Sergi;Douady, Stéphane;Theraulaz, Guy",16199989700;7005169161;12787383800;7006393703;6701806111;7004591018
10.1016/j.visres.2007.01.011,16,"This study investigates the role played by individual spatial scales in determining the apparent brightness of greyscale patterns. We measured the perceived difference in brightness across an edge in the presence of notch filtering and high-pass filtering for two stimulus configurations, one that elicits the perception of transparency and one that appears opaque. For both stimulus configurations, the apparent brightness of the surfaces delimited by the border decreased monotonically with progressive (ideal) high-pass filtering, with a critical cut-off at 1 c/deg. Using two octave ideal notch filtering, the maximum detrimental effect on apparent brightness was observed at about 1 c/deg. Critical frequencies for apparent brightness did not vary with contrast, viewing distance, or surface size, suggesting that apparent brightness is determined by the channel tuned at 1 c/deg. Modelling the data with the local energy model [Morrone, M. C., & Burr, D. C. (1988). Feature detection in human vision: a phase dependent energy model. Proceedings of the Royal Society (London), B235, 221-245] at 1 c/deg confirmed the suggestion that this channel mediates apparent brightness for both opaque and transparent borders, with no need for pooling or integration across spatial channels. © 2007 Elsevier Ltd. All rights reserved.","Perna, A.;Morrone, M. C.",16199989700;7004710787
10.1016/j.neuron.2005.07.012,53,"Biological visual systems are extraordinarily capable of recovering the shape and brightness of objects from sparse and fragmentary information. Using functional magnetic imaging, we show that two associative areas of the dorsal pathway - in the caudal region of the intrapariatal sulcus and in the lateral occipital sulcus - respond specifically to the Craik-O'Brien-Cornsweet illusion generated by high-pass filtered edges. Other visual areas, including primary visual cortex, also respond strongly to the retinotopic location of the edge, but these areas respond equally well to a line of matched contrast and detectability, rather than specifically to the brightness illusion. The reconstruction of surface and/or its brightness seems to be achieved by associative areas from the information about visual features provided by the primary visual cortices, even where there is no physical difference in luminance. Copyright ©2005 by Elsevier Inc.","Perna, Andrea;Tosetti, Michela;Montanaro, Domenico;Morrone, M. Concetta",16199989700;6701756843;36764310900;7004710787
