doi,citedby_count,description,author_names,author_ids
10.1098/rsif.2020.0093,6,"We present a simple three-dimensional model to describe the autonomous expansion of a substrate whose growth is driven by the local mean curvature of its surface. The model aims to reproduce the nest construction process in arboreal Nasutitermes termites, whose cooperation may similarly be mediated by the shape of the structure they are walking on, for example focusing the building activity of termites where local mean curvature is high. We adopt a phase-field model where the nest is described by one continuous scalar field and its growth is governed by a single nonlinear equation with one adjustable parameter d. When d is large enough the equation is linearly unstable and fairly reproduces a growth process in which the initial walls expand, branch and merge, while progressively invading all the available space, which is consistent with the intricate structures of real nests. Interestingly, the linear problem associated with our growth equation is analogous to the buckling of a thin elastic plate under symmetric in-plane compression, which is also known to produce rich patterns through nonlinear and secondary instabilities. We validated our model by collecting nests of two species of arboreal Nasutitermes from the field and imaging their structure with a micro-computed tomography scanner. We found a strong resemblance between real and simulated nests, characterized by the emergence of a characteristic length scale and by the abundance of saddle-shaped surfaces with zero-mean curvature, which validates the choice of the driving mechanism of our growth model.","Facchini, G.;Lazarescu, A.;Perna, A.;Douady, S.",57196594915;43661346300;16199989700;6701806111
10.1007/s00114-020-01675-0,5,"Nests of social insects are an important area for the exchange of food and information among workers. We investigated how the topology of nest chambers (as opposed to nest size or environmental factors) affects the spatial distribution of nestmates and the foraging behavior of Myrmica rubra ant colonies. Colonies were housed in artificial nests, each with same-sized chambers differing in the spatial arrangement of galleries. A highly connected central chamber favored higher occupancy rates and a more homogeneous distribution of ants across chambers. In contrast, a chain of successive chambers led to a more heterogeneous distribution of ants, with the occupancy of a chamber chiefly mediated by its distance to the entrance. Irrespective of nest topology, the entrance chamber housed the largest proportion of ants, often including the queen, which exhibited a preference for staying in densely populated chambers. Finally, we investigated how nest topology influenced nestmate recruitment. Surprisingly, a highly connected chamber in the center of the nest did not promote greater recruitment nor activation of ants. At the onset of foraging, the largest number of moving ants was reached in the topology where the most connected chamber was the nest entrance. Later in the process, we found that a chain of successive chambers was the best topology for promoting ant’s mobilization. Our work demonstrates that nest topology can shape the spatial organization and the collective response of ant colonies, thereby taking part in their adaptative strategies to exploit environmental resources.","Vaes, Oscar;Perna, Andrea;Detrain, Claire",57216889608;16199989700;6701582926
10.1111/ibi.12710,15,"We understand little about the energetic costs of flight in free-ranging birds, in part because current techniques for estimating flight energetics in the wild are limited. Accelerometry is known to estimate energy expenditure through body movement in terrestrial animals, once calibrated using a treadmill with chamber respirometry. The flight equivalent, a wind tunnel with mask respirometry, is particularly difficult to instigate, and has not been applied to calibrate accelerometry. We take the first steps in exploring a novel method for calibrating accelerometers with flight energy expenditure. We collected accelerometry data for Harris's Hawks Parabuteo unicinctus flying to varying heights up to 4.1 m over a small horizontal distance; the mechanical energy expended to gain height can be estimated from physical first principles. The relationship between accelerometry and mechanical energy expenditure was strong, and while a simple wing flapping model confirmed that accelerometry is sensitive to both changes in wing beat amplitude and frequency, the relationship was explained predominately by changes in wing beat frequency, and less so by changes in amplitude. Our study provides initial, positive evidence that accelerometry can be calibrated with body power using climbing flights, potentially providing a basis for estimating flapping flight metabolic rate at least in situations of altitude gain.","Van Walsum, Tessa A.;Perna, Andrea;Bishop, Charles M.;Murn, Campbell P.;Collins, Philip M.;Wilson, Rory P.;Halsey, Lewis G.",57195523910;16199989700;7202946737;6506197824;56088003500;7501526090;6701887278
10.1038/s41467-018-08039-3,12,"The size structure of autotroph communities – the relative abundance of small vs. large individuals – shapes the functioning of ecosystems. Whether common mechanisms underpin the size structure of unicellular and multicellular autotrophs is, however, unknown. Using a global data compilation, we show that individual body masses in tree and phytoplankton communities follow power-law distributions and that the average exponents of these individual size distributions (ISD) differ. Phytoplankton communities are characterized by an average ISD exponent consistent with three-quarter-power scaling of metabolism with body mass and equivalence in energy use among mass classes. Tree communities deviate from this pattern in a manner consistent with equivalence in energy use among diameter size classes. Our findings suggest that whilst universal metabolic constraints ultimately underlie the emergent size structure of autotroph communities, divergent aspects of body size (volumetric vs. linear dimensions) shape the ecological outcome of metabolic scaling in forest vs. pelagic ecosystems.","Perkins, Daniel M.;Perna, Andrea;Adrian, Rita;Cermeño, Pedro;Gaedke, Ursula;Huete-Ortega, Maria;White, Ethan P.;Yvon-Durocher, Gabriel",35318508500;16199989700;7103321653;8842965300;6701317546;23481640600;7401613097;15844582700
10.1098/rsif.2019.0212,3,"Group living animals form aggregations and flocks that remain cohesive in spite of internal movements of individuals. This is possible because individual group members repeatedly adjust their position and motion in response to the position and motion of other group members. Here, we develop a theoretical approach to address the question, what general features—if any—underlie the interaction rules that mediate group stability in animals of all species? We do so by considering how the spatial organization of a group would change in the complete absence of interactions. Without interactions, a group would disperse in a way that can be easily characterized in terms of Fick’s diffusion equations. We can hence address the inverse theoretical problem of finding the individual-level interaction responses that are required to counterbalance diffusion and to preserve group stability. We show that an individual-level response to neighbour densities in the form of Weber’s Law (a ‘universal’ law describing the functioning of the sensory systems of animals of all species) results in an ‘anti-diffusion’ term at the group level. On short timescales, this anti-diffusion restores the initial group configuration in a way that is reminiscent of methods for image deblurring in image processing. We also show that any non-homogeneous, spatial density distribution can be preserved over time if individual movement patterns have the form of a Weber’s Law response. Weber’s Law describes the fundamental functioning of perceptual systems. Our study indicates that it is also a necessary—but not sufficient—feature of collective interactions in stable animal groups.","Perna, Andrea;Facchini, Giulio;Deneubourg, Jean Louis",16199989700;57196594915;7004387896
10.1242/jeb.197434,7,"Analysis of some experimental biology data involves linear regression and interpretation of the resulting slope value. Usually, the x-axis measurements include noise. Noise in the x-variable can create regression dilution, and many biologists are not aware of the implications: regression dilution results in an underestimation of the true slope value. This is particularly problematic when the slope value is diagnostic. For example, energy management strategies of animals can be determined from the regression slope estimate of mean energy expenditure against resting energy expenditure. Typically, energy expenditure is represented by a proxy such as heart rate, which adds substantive measurement error. With simulations and analysis of empirical data, we explore the possible effect of regression dilution on interpretations of energy management strategies. We conclude that unless the coefficient of determination r2 is very high, there is a good possibility that regression dilution will affect qualitative interpretation. We recommend some ways to contend with regression dilution, including the application of alternative available regression approaches under certain circumstances.","Halsey, Lewis G.;Perna, Andrea",6701887278;16199989700
10.1016/j.beproc.2017.12.006,7,"Collective movement is achieved when individuals adopt local rules to interact with their neighbours. How the brain processes information about neighbours’ positions and movements may affect how individuals interact in groups. As brain size can determine such information processing it should impact collective animal movement. Here we investigate whether brain size affects the structure and organisation of newly forming fish shoals by quantifying the collective movement of guppies (Poecilia reticulata) from large- and small-brained selection lines, with known differences in learning and memory. We used automated tracking software to determine shoaling behaviour of single-sex groups of eight or two fish and found no evidence that brain size affected the speed, group size, or spatial and directional organisation of fish shoals. Our results suggest that brain size does not play an important role in how fish interact with each other in these types of moving groups of unfamiliar individuals. Based on these results, we propose that shoal dynamics are likely to be governed by relatively basic cognitive processes that do not differ in these brain size selected lines of guppies.","Kotrschal, Alexander;Szorkovszky, Alexander;Romenskyy, Maksym;Perna, Andrea;Buechel, Severine D.;Zeng, Hong Li;Pelckmans, Kristiaan;Sumpter, David;Kolm, Niclas",24401153000;24469202700;55651198600;16199989700;36482417600;57194173787;9275487200;6602893688;6602955806
10.1371/journal.pcbi.1005822,46,"Schools of fish and flocks of birds can move together in synchrony and decide on new directions of movement in a seamless way. This is possible because group members constantly share directional information with their neighbors. Although detecting the directionality of other group members is known to be important to maintain cohesion, it is not clear how many neighbors each individual can simultaneously track and pay attention to, and what the spatial distribution of these influential neighbors is. Here, we address these questions on shoals of Hemigrammus rhodostomus, a species of fish exhibiting strong schooling behavior. We adopt a data-driven analysis technique based on the study of short-term directional correlations to identify which neighbors have the strongest influence over the participation of an individual in a collective U-turn event. We find that fish mainly react to one or two neighbors at a time. Moreover, we find no correlation between the distance rank of a neighbor and its likelihood to be influential. We interpret our results in terms of fish allocating sequential and selective attention to their neighbors.","Jiang, Li;Giuggioli, Luca;Perna, Andrea;Escobedo, Ramón;Lecheval, Valentin;Sire, Clément;Han, Zhangang;Theraulaz, Guy",56367949800;8090235100;16199989700;6603516544;56305998100;7003883309;55032189600;7004591018
10.1098/rspb.2017.1126,91,"Predation is thought to shape the macroscopic properties of animal groups, making moving groups more cohesive and coordinated. Precisely how predation has shaped individuals’ fine-scale social interactions in natural populations, however, is unknown. Using high-resolution tracking data of shoaling fish (Poecilia reticulata) from populations differing in natural predation pressure, we show how predation adapts individuals’ social interaction rules. Fish originating from high predation environments formed larger, more cohesive, but not more polarized groups than fish from low predation environments. Using a new approach to detect the discrete points in time when individuals decide to update their movements based on the available social cues, we determine how these collective properties emerge from individuals’ microscopic social interactions. We first confirm predictions that predation shapes the attraction–repulsion dynamic of these fish, reducing the critical distance at which neighbours move apart, or come back together. While we find strong evidence that fish align with their near neighbours, we do not find that predation shapes the strength or likelihood of these alignment tendencies. We also find that predation sharpens individuals’ acceleration and deceleration responses, implying key perceptual and energetic differences associated with how individuals move in different predation regimes. Our results reveal how predation can shape the social interactions of individuals in groups, ultimately driving differences in groups’ collective behaviour.","Herbert-Read, James E.;Rosén, Emil;Szorkovszky, Alex;Ioannou, Christos C.;Rogell, Björn;Perna, Andrea;Ramnarine, Indar W.;Kotrschal, Alexander;Kolm, Niclas;Krause, Jens;Sumpter, David J.T.",35726673000;57195522817;24469202700;14031534600;9640421100;16199989700;6603763150;24401153000;6602955806;7202955124;6602893688
10.1088/1361-6463/50/1/014002,11,"Some organisms, including fungi, ants, and slime molds, explore their environment and forage by forming interconnected networks. The plasmodium of the slime mold Physarum polycephalum is a large unicellular amoeboid organism that grows a tubular spatial network through which nutrients, body mass, and chemical signals are transported. Individual plasmodia are capable of sophisticated behaviours such as optimizing their network connectivity and dynamics using only decentralized information processing. In this study, we used a population of plasmodia that interconnect through time to analyse the dynamical interactions between growth of individual plasmodia and global network formation. Our results showed how initial conditions, such as the distance between plasmodia, their size, or the presence and quality of food, affect the emerging network connectivity.","Vogel, David;Gautrais, Jacques;Perna, Andrea;Sumpter, David J.T.;Deneubourg, Jean Louis;Dussutour, Audrey",56975989300;6506823391;16199989700;6602893688;7004387896;22633963800
10.1242/jeb.143347,51,"The nests built by social insects are among the most complex structures produced by animal groups. They reveal the social behaviour of a colony and as such they potentially allow comparative studies. However, for a long time, research on nest architecture was hindered by the lack of technical tools allowing the visualisation of their complex 3D structures and the quantification of their properties. Several techniques, developed over the years, now make it possible to study the organisation of these nests and how they are built. Here, we review present knowledge of the mechanisms of nest construction, and how nest structure affects the behaviour of individual insects and the organisation of activities within a colony.","Perna, Andrea;Theraulaz, Guy",16199989700;7004591018
10.1109/FAS-W.2016.42,2,"The nests built by termites of the genus Apicotermes present a regular succession of floors interconnected by vertical passages. By scanning these nests with X-ray tomography we observed that two different configurations of vertical passages coexist: Ramps and helices. Based on our current knowledge of the mechanisms of nest building behaviour in different groups of social insects we formulate hypotheses about the mechanisms that could lead to the formation of these structures. In particular, we show that a 3D model of nest building in Lasius Niger ants (Khuong et al, 2016) is capable of producing layered structures with vertical helices similar to the structures built by Apicotermes by simply running it with parameters different from those empirically measured for ants. It is possible that similar self-organised building mechanisms underlie the construction of the different nest structures produced by different groups of social insects.","Guo, Lijie;Theraulaz, Guy;Jost, Christian;Perna, Andrea",57193134440;7004591018;7005169161;16199989700
10.1073/pnas.1509829113,71,"The nests of social insects are not only impressive because of their sheer complexity but also because they are built from individuals whose work is not centrally coordinated. A key question is how groups of insects coordinate their building actions. Here, we use a combination of experimental and modeling approaches to investigate nest construction in the ant Lasius Niger. We quantify the construction dynamics and the 3D structures built by ants. Then, we characterize individual behaviors and the interactions of ants with the structures they build. We show that two main interactions are involved in the coordination of building actions: (i) a stigmergic-based interaction that controls the amplification of depositions at some locations and is attributable to a pheromone added by ants to the building material; and (ii) a template-based interaction in which ants use their body size as a cue to control the height at which they start to build a roof from existing pillars. We then develop a 3D stochastic model based on these individual behaviors to analyze the effect of pheromone presence and strength on construction dynamics. We show that the model can quantitatively reproduce key features of construction dynamics, including a large-scale pattern of regularly spaced pillars, the formation and merging of caps over the pillars, and the remodeling of built structures. Finally, our model suggests that the lifetime of the pheromone is a highly influential parameter that controls the growth and form of nest architecture.","Khuong, Anaïs;Gautrais, Jacques;Perna, Andrea;Sbaï, Chaker;Combe, Maud;Kuntz, Pascale;Jost, Christian;Theraulaz, Guy",55670070600;6506823391;16199989700;57090998200;23388516900;7004843798;7005169161;7004591018
10.1103/PhysRevE.92.062810,4,"We present a model for the growth of the transportation network inside nests of the social insect subfamily Termitinae (Isoptera, termitidae). These nests consist of large chambers (nodes) connected by tunnels (edges). The model based on the empirical analysis of the real nest networks combined with pruning (edge removal, either random or weighted by betweenness centrality) and a memory effect (preferential growth from the latest added chambers) successfully predicts emergent nest properties (degree distribution, size of the largest connected component, average path lengths, backbone link ratios, and local graph redundancy). The two pruning alternatives can be associated with different genuses in the subfamily. A sensitivity analysis on the pruning and memory parameters indicates that Termitinae networks favor fast internal transportation over efficient defense strategies against ant predators. Our results provide an example of how complex network organization and efficient network properties can be generated from simple building rules based on local interactions and contribute to our understanding of the mechanisms that come into play for the formation of termite networks and of biological transportation networks in general.","Eom, Young Ho;Perna, Andrea;Fortunato, Santo;Darrouzet, Eric;Theraulaz, Guy;Jost, Christian",8454032000;16199989700;7005680829;6603942606;7004591018;7005169161
10.1098/rsif.2014.0334,33,"Many group-living animals construct transportation networks of trails, galleries and burrows by modifying the environment to facilitate faster, safer or more efficient movement. Animal transportation networks can have direct influences on the fitness of individuals, whereas the shape and structure of transportation networks can influence community dynamics by facilitating contacts between different individuals and species. In this review, we discuss three key areas in the study of animal transportation networks: the topological properties of networks, network morphogenesis and growth, and the behaviour of network users. We present a brief primer on elements of network theory, and then discuss the different ways in which animal groups deal with the fundamental trade-off between the competing network properties of travel efficiency, robustness and infrastructure cost.We consider howthe behaviour of network users can impact network efficiency, and call for studies that integrate both network topology and user behaviour. We finish with a prospectus for future research.","Perna, Andrea;Latty, Tanya",16199989700;15045021300
10.1186/s40462-014-0022-5,20,"Recent research in animal behaviour has contributed to determine how alignment, turning responses, and changes of speed mediate flocking and schooling interactions in different animal species. Here, we propose a complementary approach to the analysis of flocking phenomena, based on the idea that animals occupy preferential, anysotropic positions with respect to their neighbours, and devote a large amount of their interaction responses to maintaining their mutual positions. We test our approach by deriving the apparent alignment and attraction responses from simulated trajectories of animals moving side by side, or one in front of the other. We show that the anisotropic positioning of individuals, in combination with noise, is sufficient to reproduce several aspects of the movement responses observed in real animal groups. This anisotropy at the level of interactions should be considered explicitly in future models of flocking and schooling. By making a distinction between interaction responses involved in maintaining a preferred flock configuration, and interaction responses directed at changing it, our work provides a frame to discriminate movement interactions that signal directional conflict from interactions underlying consensual group motion.","Perna, Andrea;Grégoire, Guillaume;Mann, Richard P.",16199989700;7005342113;35248716800
10.1098/rsif.2013.0529,72,"Travelling in groups gives animals opportunities to share route information by following cues from each other's movement. The outcome of group navigation will depend on how individuals respond to each other within a flock, school, swarm or herd. Despite the abundance of modelling studies, only recently have researchers developed techniques to determine the interaction rules among real animals. Here, we use high-resolution GPS (global positioning system) tracking to study these interactions in pairs of pigeons flying home from a familiar site. Momentary changes in velocity indicate alignment with the neighbour's direction, as well as attraction or avoidance depending on distance. Responses were stronger when the neighbour was in front. From the flocking behaviour, we develop a model to predict features of group navigation. Specifically, we show that the interactions between pigeons stabilize a side-by-side configuration, promoting bidirectional information transfer and reducing the risk of separation. However, if one bird gets in front it will lead directional choices. Our model further predicts, and observations confirm, that a faster bird (as measured from solo flights) will fly slightly in front and thus dominate the choice of homing route. Our results explain how group decisions emerge from individual differences in homing flight behaviour. © 2013 The Author(s) Published by the Royal Society. All rights reserved.","Pettit, Benjamin;Perna, Andrea;Biro, Dora;Sumpter, David J.T.",54889834300;16199989700;7003606673;6602893688
10.1007/978-3-319-00395-5_73,2,"Recent experiments by Ward et al. have shown that fish a moving fish group detects hidden predators faster and more accurately than isolated individuals. The increase in speed, in particular, seems to be a consequence of the movement-mediated nature of the interactions used by fish to share information. The present work aims at investigating the link between movement and information transfer underlying collective decisions in fish. We define an individual-based self-propelled particle (SPP) model of the decision-making process analyzed by Ward et al. We fit it to data in order to deduce the smallest set of interaction rules consistent with the experimentally observed behaviour. We infer the relative weight of different social forces on fish movement during the decision-making process. We find that, in order to reproduce the observed experimental trends, both the social forces of alignment and attraction have to be introduced in the model, alignment playing a more important role than attraction. We finally apply this model to make theoretical predictions about fish ability to detect and avoid a moving predator in a natural environment such as open water.","Bottinelli, Arianna;Perna, Andrea;Ward, Ashley;Sumpter, David",55447638000;16199989700;35579996400;6602893688
