doi,citedby_count,description,author_names,author_ids
,25,"The Internet of Things (IoT) offers the infrastructure of the information society. It hosts smart objects that automatically collect and exchange data of various kinds, directly gathered from sensors or generated by aggregations. Suitable coordination primitives and analysis mechanisms are in order to design and reason about IoT systems, and to intercept the implied technological shifts. We address some of these issues from a foundational point of view. To study them, we define IoT-LySa, a process calculus endowed with a static analysis that tracks the provenance and the manipulation of IoT data, and how they flow in the system. The results of the analysis can be used by a designer to check the behaviour of smart objects, in particular to verify non-functional properties, among which security.","Bodei, Chiara;Degano, Pierpaolo;Ferrari, Gian Luigi;Galletta, Letterio",6603107885;7006345611;56221627000;55260418300
10.1007/978-3-319-62932-2_1,1,"Contextual information plays an increasingly crucial role in concurrent applications in the times of mobility and pervasiveness of computing. Context-Oriented Programming languages explicitly treat this kind of information. They provide primitive constructs to adapt the behaviour of a program, depending on the evolution of its operational environment, which is affected by other programs hosted therein independently and unpredictably. We discuss these issues and the challenges they pose, reporting on our recent work on ML CoDa, a language specifically designed for adaptation and equipped with a clear formal semantics and analysis tools. We will show how applications and context interactions can be better specified, analysed and controlled, with the help of some experiments done with a preliminary implementation of ML CoDa.","Bodei, Chiara;Degano, Pierpaolo;Ferrari, Gian Luigi;Galletta, Letterio",6603107885;7006345611;56221627000;55260418300
,12,"The Internet of Things (IoT) produces and processes large amounts of data. Among these data, some must be protected and others must be carefully handled because they come from untrusted sources. Taint analysis techniques can be used to for marking data and for monitoring their propagation at run time, so to determine how they influence the rest of the computation. Starting from the specification language IOT-LYSA, we propose a Control Flow Analysis for statically predicting how tainted data spread across an IoT system and for checking whether those computations considered security critical are not affected by tainted data.","Bodei, Chiara;Galletta, Letterio",6603107885;55260418300
10.4204/EPTCS.223.9,12,"The Internet of Things (IoT) is smartifying our everyday life. Our starting point is IOT-LYSA, a calculus for describing IoT systems, and its static analysis, which will be presented at Coordination 2016. We extend the mentioned proposal in order to begin an investigation about security issues, in particular for the static verification of secrecy and some other security properties.","Bodei, Chiara;Degano, Pierpaolo;Ferrari, Gian Luigi;Galletta, Letterio",6603107885;7006345611;56221627000;55260418300
10.4204/EPTCS.211.4,3,"Context-Oriented Programming languages provide us with primitive constructs to adapt program behaviour depending on the evolution of their operational environment, namely the context. In previous work we proposed MLCoDa, a context-oriented language with two-components: a declarative constituent for programming the context and a functional one for computing. This paper describes an extension of MLCoDa to deal with adaptation to unpredictable context changes notified by asynchronous events.","Degano, Pierpaolo;Ferrari, Gian Luigi;Galletta, Letterio",7006345611;56221627000;55260418300
10.1109/TSE.2015.2496941,12,"Adaptive systems are designed to modify their behaviour in response to changes of their operational environment. We propose a two-component language for adaptive programming, within the Context-Oriented Programming paradigm. It has a declarative constituent for programming the context and a functional one for computing. We equip our language with a dynamic formal semantics. Since wrong adaptation could severely compromise the correct behaviour of applications and violate their properties, we also introduce a two-phase verification mechanism. It is based on a type and effect system that type-checks programs and computes, as an effect, a sound approximation of their behaviour. The effect is exploited at load time to mechanically verify that programs correctly adapt themselves to all possible running environments.","Degano, Pierpaolo;Ferrari, Gian Luigi;Galletta, Letterio",7006345611;56221627000;55260418300
,2,"A concurrent extension of the recent COP language MLCoDa is presented. We formalise its operational semantics and we propose a run time verification mechanism that enforces a notion of non-interference among concurrent threads. More precisely, this mechanism prevents an application from modifying the context so as to dispose some resources or to contradict assumptions upon which other applications rely.","Busi, Matteo;Degano, Pierpaolo;Galletta, Letterio",57192711957;7006345611;55260418300
,4,"More smart objects and more applications on the Internet of Things (IoT) mean more security challenges. In IoT security is crucial but difficult to obtain. On the one hand the usual trade-off between highly secure and usable systems is more impelling than ever; on the other hand security is considered a feature that has a cost often unaffordable. To relieve this kind of problems, IoT designers not only need tools to assess possible risks and to study countermeasures, but also methodologies to estimate their costs. Here, we present a preliminary methodology, based on the process calculus IoT-LySa, to infer quantitative measures on systems evolution. The derived quantitative evaluation is exploited to establish the cost of the possible security countermeasures.","Bodei, Chiara;Galletta, Letterio",6603107885;55260418300
10.3233/JCS-160551,8,"Adaptive systems improve their efficiency by modifying their behaviour to respond to changes in their operational environment. Also, security must adapt to these changes and policy enforcement becomes dependent on the dynamic contexts. We study these issues within MLCoDa, (the core of) an adaptive declarative language proposed recently. A main characteristic of MLCoDa is to have two components: a logical one for handling the context and a functional one for computing. We extend this language with security policies that are expressed in logical terms. They are of two different kinds: context and application policies. The first, unknown a priori to an application, protect the context from unwanted changes. The others protect the applications from malicious actions of the context, can be nested and can be activated and deactivated according to their scope. An execution step can only occur if all the policies in force hold, under the control of an execution monitor. Beneficial to this is a type and effect system, which safely approximates the behaviour of an application, and a further static analysis, based on the computed effect. The last analysis can only be carried on at load time, when the execution context is known, and it enables us to efficiently enforce the security policies on the code execution, by instrumenting applications. The monitor is thus implemented within MLCoDa, and it is only activated on those policies that may be infringed, and switched off otherwise.","Bodei, Chiara;Degano, Pierpaolo;Galletta, Letterio;Salvatori, Francesco",6603107885;7006345611;55260418300;56711721400
10.1007/978-3-319-39519-7_3,21,"The Internet of Things (IoT) is here: smart objects are pervading our everyday life. Smart devices automatically collect and exchange data of various kinds, directly gathered from sensors or generated by aggregations. Suitable coordination primitives and analysis mechanisms are in order to design and reason about IoT systems, and to intercept the implied technology shifts. We address these issues by defining IoT-LySa, a process calculus endowed with a static analysis that tracks the provenance and the route of IoT data, and detects how they affect the behaviour of smart objects.","Bodei, Chiara;Degano, Pierpaolo;Ferrari, Gian Luigi;Galletta, Letterio",6603107885;7006345611;56221627000;55260418300
10.1007/978-3-319-27810-0_2,2,"We extend an existing two-phase static analysis for an adaptive programming language to also deal with dynamic resources. The focus of our analysis is on predicting how these are used, in spite of the different, ever changing operating environments to which applications automatically adapt their behaviour. Our approach is based on a type and effect system at compile time, followed by a control flow analysis carried on at loading time. Remarkably, the second analysis cannot be anticipated, because information about availability, implementation and other aspects of resources are unknown until the application is injected in the current environment.","Bodei, Chiara;Degano, Pierpaolo;Ferrari, Gian Luigi;Galletta, Letterio",6603107885;7006345611;56221627000;55260418300
10.4204/EPTCS.201.2,6,"Context-Oriented programming languages provide us with primitive constructs to adapt program behaviour depending on the evolution of their operational environment, namely the context. In previous work we proposed MLcoDa, a context-oriented language with two-components: a declarative constituent for programming the context and a functional one for computing. This paper describes the implementation of MLcoDa as an extension of F#.","Canciani, Andrea;Degano, Pierpaolo;Ferrari, Gian Luigi;Galletta, Letterio",56789967500;7006345611;56221627000;55260418300
10.1007/978-3-319-25527-9_10,1,"Context-Oriented programming languages provide us with primitive constructs to adapt programs behaviour depending on the evolution of their operational environment. In this paradigm developers must provide behaviour for any context a program may find in. A missing behaviour causes a new kind of runtime error: an adaptation error. We propose a novel mechanism, based on implicit function, that allows the execution environment to supply such behaviour when the program is not able to adapt. We assess our proposal extending a core functional language designed for adaptivity. We integrate the mechanism in a type and effect system, in the form of implicit coercions, showing that our type discipline guarantees that no adaptation errors occur.","Basile, Davide;Galletta, Letterio;Mezzetti, Gianluca",55960640200;55260418300;51161481600
10.1007/978-3-319-10882-7_5,9,"Adaptive systems improve their efficiency, by modifying their behaviour to respond to changes in their operational environment. Also, security must adapt to these changes and policy enforcement becomes dependent on the dynamic contexts. We extend (the core of) an adaptive functional language with primitives to enforce security policies on the code execution, and we exploit a static analysis to instrument programs. The introduced checks guarantee that no violation of the required security policies occurs.","Bodei, Chiara;Degano, Pierpaolo;Galletta, Letterio;Salvatori, Francesco",6603107885;7006345611;55260418300;56711721400
10.3233/FI-2014-1106,0,"Type and effect systems significantly extend type systems and allow one to express general semantic properties and to statically reason about programs execution. They have been widely exploited to specify static analyses, for example to track computational side effects, resource usage and communication in concurrent languages. In this paper we adopt abstract interpretation techniques to express type and effect systems as abstract semantics. We extend the Cousot's methodology by introducing an abstract domain which (i) is able to express types with annotations, (ii) is reusable in different analyses with few modifications and (iii) is easily implementable. To test our approach we reconstruct two analyses for which the type and effect systems approach were successful.","Galletta, Letterio",55260418300
10.1007/978-3-319-10431-7_28,9,"Adaptive systems are designed to modify their behaviour in response to changes of their operational environment. We adopt a language-based approach to the development of such systems, with particular attention to preventing them from failures in adaptation. The kernel of our proposal is a simple core language, equipped with a type and effect system that computes a sound approximation of program behaviour. The effect is exploited at loading time to verify that programs correctly adapt themselves to all possible running environments. © 2014 Springer International Publishing.","Degano, Pierpaolo;Ferrari, Gian Luigi;Galletta, Letterio",7006345611;56221627000;55260418300
10.1145/2637066.2637072,9,"Adaptive applications are designed and programmed to dynamically adjust their behaviour to respond to changes of their execution environment. This paper introducesMLCoDa, a new COP language, made of two components: a declarative one for the context and a functional constituent for computing. Here we concentrate on the rational behind the design of MLCoDa and on its dynamic semantics. We also sketch a verification mechanism based on static analysis to prevent wrong adaptations which could compromise the correct behaviour of applications.","Degano, Pierpaolo;Ferrari, Gian Luigi;Galletta, Letterio",7006345611;56221627000;55260418300
10.4204/EPTCS.109.5,3,"Context Oriented Programming (COP) concerns the ability of programs to adapt to changes in their running environment. A number of programming languages endowed with COP constructs and features have been developed. However, some foundational issues remain unclear. This paper proposes adopting static analysis techniques to reason on and predict how programs adapt their behaviour. We introduce a core functional language, ContextML, equipped with COP primitives for manipulating contexts and for programming behavioural variations. In particular, we specify the dispatching mechanism, used to select the program fragments to be executed in the current active context. Besides the dynamic semantics we present an annotated type system. It guarantees that the well-typed programs adapt to any context, i.e. the dispatching mechanism always succeeds at run-time.","Degano, Pierpaolo;Ferrari, Gian Luigi;Galletta, Letterio;Mezzetti, Gianluca",7006345611;56221627000;55260418300;51161481600
10.1007/978-3-642-30829-1_18,13,"Context-Oriented programming languages provide us with primitive constructs to adapt program behaviour depending on the evolution of their operational environment. We are interested here in software components, the behaviour of which depend on the following: their actual operating context; the security policies that control accesses to their resources and the potential interactions with the external environment. For that, we extend a core functional language with mechanisms to program behavioural variations, to manipulate resources and to enforce security policies over both variations and resource usages. Additionally, there are message passing primitives to interact with the environment, also subject to a simple policy. Changes of the operational context are triggered both by the program and by the exchanged messages. Besides a definition of the dynamic semantics, we introduce a static analysis for guaranteeing programs to safely operate in any admissible context, and to correctly interact with the environment they comply with. © 2012 IFIP International Federation for Information Processing.","Degano, Pierpaolo;Ferrari, Gian Luigi;Galletta, Letterio;Mezzetti, Gianluca",7006345611;56221627000;55260418300;51161481600
10.1007/978-3-642-33260-9_1,6,"We survey some critical issues arising in the ubiquitous computing paradigm, in particular the interplay between context-awareness and security. We then overview a language-based approach that addresses these problems from the point of view of Formal Methods. More precisely, we briefly describe a core functional language extended with mechanisms to express adaptation to context changes, to manipulate resources and to enforce security policies. In addition, we shall outline a static analysis for guaranteeing programs to securely behave in the digital environment they are part of. © 2012 IFIP International Federation for Information Processing.","Bodei, Chiara;Degano, Pierpaolo;Ferrari, Gian Luigi;Galletta, Letterio;Mezzetti, Gianluca",6603107885;7006345611;56221627000;55260418300;51161481600
10.4204/EPTCS.61.6,1,"Types-and-effects are type systems, which allow one to express general semantic properties and to statically reason about program’s execution. They have been widely exploited to specify static analyses, for example to track computational side effects, exceptions and communications in concurrent programs. In this paper we adopt abstract interpretation techniques to reconstruct (following the Cousot’s methodology) a types-and-effects system developed to handle security problems of a multi-tier web language. Our reconstruction allows us to show that this types-and-effects system is not sound with respect to the semantics of the language. In addition, we correct the soundness issues in the analysis and systematically construct a correct analyser.","Galletta, Letterio;Levi, Giorgio",55260418300;7201810836
