doi,citedby_count,description,author_names,author_ids
10.1002/cpe.6749,4,"We analyze the protocol of the bitcoin blockchain by using the PRISM probabilistic model checker. In particular, we (i) extend PRISM with the ledger data type, (ii) model the behavior of the key participants in the protocol—the miners—and (iii) describe the whole protocol as a parallel composition of processes. The probabilistic analysis of the model highlights how forks happen and how they depend on specific parameters of the protocol, such as the difficulty of the cryptopuzzle and the network communication delays. Our results confirm that considering transactions in blocks at depth larger than 5 as confirmed is reasonable because the majority of miners have consistent blockchains up-to that depth with probability of almost 1. We also study the behavior of networks with churn miners, which may leave the network and rejoin afterwards, and with different topologies.","Bistarelli, Stefano;De Nicola, Rocco;Galletta, Letterio;Laneve, Cosimo;Mercanti, Ivan;Veschetti, Adele",7004079468;7004298169;55260418300;57204667252;57205026850;57211373939
10.1016/j.cose.2023.103133,0,"Physical layer security mechanisms use primitives that exploit physical properties of the communication channel to protect data. Protecting communications at the physical layer offers some advantages, e.g., in terms of reduced computations, since complex cryptographic procedures are not executed, However, these mechanisms lack a formal specification that prevent protocols and applications that use them from being verified and compared with those based on cyptography. Here we start filling this gap by providing an axiomatization of key physical layer security primitives and proposing a variant of the Dolev–Yao attacker model that takes them into account. We show that our formalization enables applying existing automatic tools for verifying security of protocols. Then, we show that these primitives are a valuable alternative and effective complement to cryptography, because they ensure confidentiality and integrity but require a lower energy consumption and often they also reduce transmission time. Finally, we characterize the specific application domains and network features that make adopting these security mechanisms particularly profitable with respect to the AES cypher.","Costa, Gabriele;Degano, Pierpaolo;Galletta, Letterio;Soderi, Simone",32067717500;7006345611;55260418300;56027760800
10.1016/j.jlamp.2023.100848,0,"Component based software engineering (CBSE) is a methodology that aims to design and build software systems by assembling together reusable and loosely coupled components. Applying CBSE in a distributed setting is appealing but challenging: distributed applications require different remote components to interact following a well-defined protocol. In this paper we consider a model for message passing component-based systems where components are assembled together with a protocol, and are reactive to messages in a flexible way. We propose a type language that allows capturing component reactive behaviour and checking its compatibility with the protocol. Moreover, we show the correspondence of component and type behaviours, which entails a progress property for components.","Savanović, Zorica;Galletta, Letterio",57219504601;55260418300
10.1007/978-981-19-9601-6_12,0,"In the era of the Internet of Things, it is essential to ensure that data collected by sensors and smart devices are reliable and that they are aggregated and transmitted securely to computational components. This has significant effects on the software that manages critical decisions and actuations of IoT systems, with possibly serious consequences when linked to essential services. The development of IoT applications requires suitable techniques to understand and evaluate the complexity of the design process. Here we adopt a software engineering approach where IoT applications are formally specified (specifically in the IoT-LySa process calculus) and a Control Flow Analysis (CFA) is exploited to statically predict how data will flow through the system. Hence, the CFA builds on a kind of supply chain for subsequent aggregations and use. Based on the analysis prediction, we propose a risk analysis that captures the dependencies between collected and aggregated data and critical decisions.","Bodei, Chiara;Ferrari, Gian Luigi;Galletta, Letterio;Degano, Pierpaolo",6603107885;56221627000;55260418300;7006345611
10.1371/journal.pone.0269687,0,"The Covid19 pandemic has significantly impacted on our lives, triggering a strong reaction resulting in vaccines, more effective diagnoses and therapies, policies to contain the pandemic outbreak, to name but a few. A significant contribution to their success comes from the computer science and information technology communities, both in support to other disciplines and as the primary driver of solutions for, e.g., diagnostics, social distancing, and contact tracing. In this work, we surveyed the Italian computer science and engineering community initiatives against the Covid19 pandemic. The 128 responses thus collected document the response of such a community during the first pandemic wave in Italy (February- May 2020), through several initiatives carried out by both single researchers and research groups able to promptly react to Covid19, even remotely. The data obtained by the survey are here reported, discussed and further investigated by Natural Language Processing techniques, to generate semantic clusters based on embedding representations of the surveyed activity descriptions. The resulting clusters have been then used to extend an existing Covid19 taxonomy with the classification of related research activities in computer science and information technology areas, summarizing this work contribution through a reproducible survey-to-taxonomy methodology.","Bonnici, Vincenzo;Cicceri, Giovanni;Distefano, Salvatore;Galletta, Letterio;Polignano, Marco;Scaffidi, Carlo",36611214400;57214682745;17433851100;55260418300;56458088400;56950487900
10.1016/j.cose.2022.102683,1,"Firewalls are a fundamental tool for managing and protecting computer networks. They behave according to a configuration that specifies the desired policy, i.e., which packets are allowed to enter a network, possibly with modified addresses. Several tools allow the user to specify policies in various high level languages, and to compile them into different target configuration languages, as well as to automatically migrate a configuration from a system to another. Often, these tools implicitly assume that the target system can enforce any desired policy. Unexpectedly, we find that this is not always the case. In particular, we show that the most common UNIX firewall systems, i.e., iptables, ipfw, pf, are not equally expressive, in that some policies can be implemented in one system but not in another. Here, we formally investigate the expressive power of these firewall systems using techniques from programming language semantics, and set up a formal model to precisely characterize their relationships. Based on this formal model we then present F2F, a prototypical tool that predicts when a policy cannot be expressed in a given system. Our prototype gives detailed information about the unexpressible parts of a policy and provides administrators with hints for fixing the detected problems.","Ceragioli, Lorenzo;Degano, Pierpaolo;Galletta, Letterio",57205736407;7006345611;55260418300
10.1145/3477314.3507084,0,"Secure compilation investigates when compilation chains preserve security properties. Over the years, different formal criteria and proof techniques have been put forward for proving a compiler secure. However, these proposals require a lot of manual effort by compiler designers. This paper introduces a formal approach to mechanically support these efforts. We focus on the specific class of robust safety properties and we propose a translation validation approach that leverages program analysis techniques to check that a compilation run preserves security.","Busi, Matteo;Degano, Pierpaolo;Galletta, Letterio",57192711957;7006345611;55260418300
10.1109/CSF54842.2022.9919690,1,"Security Enhanced Linux (SELinux) is a security architecture for Linux implementing mandatory access control. It has been used in numerous security-critical contexts ranging from servers to mobile devices. But this is challenging as SELinux security policies are difficult to write, understand, and maintain. Recently, the intermediate language CIL was introduced to foster the development of high-level policy languages and to write structured configurations. However, CIL lacks mechanisms for ensuring that the resulting configurations obey desired information flow policies. To remedy this, we propose IFCIL, a backward compatible extension of CIL for specifying fine-grained information flow requirements for CIL configurations. Using IFCIL, administrators can express, e.g., confidentiality, integrity, and non-interference properties. We also provide a tool to statically verify these requirements.","Ceragioli, Lorenzo;Galletta, Letterio;Degano, Pierpaolo;Basin, David",57205736407;55260418300;7006345611;7003799223
10.1016/j.jpdc.2021.07.004,3,"The Internet of Things is deeply shaping our society and our lives. Smart devices automatically collect, aggregate and exchange data on our behalf and free us from the drudgery of doing it. These data are often crucial because critical decisions, such as controlling cyber-physical systems, are made depending on them or because they feed learning algorithms. Safety and security issues related to devices and to data can have a major impact on smart systems and can have serious consequences if they oversee essential services, such as delivering power, water, transport, and so on. For this reason, it is crucial to identify the most critical components in a network of devices and to evaluate how they are vulnerable to accidental or to intentional failures. We propose to use the process calculus IOT-LYSA to model systems and to apply a Control Flow Analysis to statically predict the manipulation of data, as well as on which data the critical decisions depend, in particular those affecting actuations. By exploiting suitable metrics, we can use the results of the analysis so as to provide system administrators with estimates of the safety and security of their systems.","Bodei, Chiara;Degano, Pierpaolo;Ferrari, Gian Luigi;Galletta, Letterio",6603107885;7006345611;56221627000;55260418300
10.1016/j.scico.2021.102657,0,"The ever-growing size of programs and their continuous evolution require building fast and efficient analyzers. Here we focus on the static ones, in particular on type systems, for both checking and inference. Just as programs change by incrementally changing or inserting pieces of code, called diffs, also type systems should be incremental and re-type the diffs, only. An algorithmic schema is proposed that mechanically derives an incremental version of existing, standard typing algorithms. Ours is a grey-box approach: just the shape of the typing rules, that of the types and some domain-specific knowledge are needed to instantiate our schema. Here, we present the foundations of our approach and the conditions for its correctness. Our schema is applied to derive four incremental typing and inference algorithms for languages in different programming paradigms. We implemented an OCaml module that inputs a type system and outputs its incrementalized version. Experimental results show that our approach is effective, and prove its usage beneficial.","Busi, Matteo;Degano, Pierpaolo;Galletta, Letterio",57192711957;7006345611;55260418300
,0,"The Covid19 pandemic heavily impacted on our lives, also as academics, triggering a strong reaction that results in vaccines, more effective diagnosis and therapies, pandemic containment policies, etc. A relevant contribution to this success is due to computer science and information technology, by either supporting other disciplines or as the main driver of solutions for, e.g., diagnostics, social distancing and contact tracing. This article reports on the italian computer scientific community activities against the Covid19 pandemic, by analysing the data obtained from a survey taken in May 2020, during the first pandemic wave in Italy, by the Covid19-IT Task Force established by the CINI (National Interuniversity Consortium for IT). The 131 responses thus collected tell us about the spontaneous reaction of such a community, made of several independent initiatives throughout Italy, which has to be kept alive, by for example evolving into more organized forms.","Bonnici, Vincenzo;Cicceri, Giovanni;Distefano, Salvatore;Galletta, Letterio;Polignano, Marco;Scaffidi, Carlo",36611214400;57214682745;17433851100;55260418300;56458088400;56950487900
10.4230/OASIcs.Tokenomics.2020.6,3,"Nowadays software is everywhere and this is particularly true for free and open source software (FOSS). Discovering bugs in FOSS projects is of paramount importance and many bug bounty programs attempt to attract skilled analysts by promising rewards. Nevertheless, developing an effective bug bounty program is challenging. As a consequence, many programs fail to support an efficient and fair bug bounty market. In this paper, we present VeriOSS, a novel bug bounty platform. The idea behind VeriOSS is to exploit the blockchain technology to develop a fair and efficient bug bounty market. To this aim, VeriOSS combines formal guarantees and economic incentives to ensure that the bug disclosure is both reliable and convenient for the market actors.","Canidio, Andrea;Costa, Gabriele;Galletta, Letterio",56593183100;32067717500;55260418300
10.46298/lmcs-17(4:10)2021,1,"Decentralized blockchain platforms have enabled the secure exchange of crypto-assets without the intermediation of trusted authorities. To this purpose, these platforms rely on a peer-to-peer network of byzantine nodes, which collaboratively maintain an append-only ledger of transactions, called blockchain. Transactions represent the actions required by users, e.g. the transfer of some units of crypto-currency to another user, or the execution of a smart contract which distributes crypto-assets according to its internal logic. Part of the nodes of the peer-to-peer network compete to append transactions to the blockchain. To do so, they group the transactions sent by users into blocks, and update their view of the blockchain state by executing these transactions in the chosen order. Once a block of transactions is appended to the blockchain, the other nodes validate it, re-executing the transactions in the same order. The serial execution of transactions does not take advantage of the multi-core architecture of modern processors, so contributing to limit the throughput. In this paper we develop a theory of transaction parallelism for blockchains, which is based on static analysis of transactions and smart contracts. We illustrate how blockchain nodes can use our theory to parallelize the execution of transactions. Initial experiments on Ethereum show that our technique can improve the performance of nodes.","Bartoletti, Massimo;Galletta, Letterio;Murgia, Maurizio",9536042900;55260418300;56426843800
10.1145/3470534,3,"Computer systems often provide hardware support for isolation mechanisms such as privilege levels, virtual memory, or enclaved execution. Over the past years, several successful software-based side-channel attacks have been developed that break, or at least significantly weaken, the isolation that these mechanisms offer. Extending a processor with new architectural or micro-architectural features brings a risk of introducing new software-based side-channel attacks. This article studies the problem of extending a processor with new features without weakening the security of the isolation mechanisms that the processor offers. Our solution is heavily based on techniques from research on programming languages. More specifically, we propose to use the programming language concept of full abstraction as a general formal criterion for the security of a processor extension. We instantiate the proposed criterion to the concrete case of extending a microprocessor that supports enclaved execution with secure interruptibility. This is a very relevant instantiation, as several recent papers have shown that interruptibility of enclaves leads to a variety of software-based side-channel attacks. We propose a design for interruptible enclaves and prove that it satisfies our security criterion. We also implement the design on an open-source enclave-enabled microprocessor and evaluate the cost of our design in terms of performance and hardware size.","Busi, Matteo;Noorman, Job;Van Bulck, Jo;Galletta, Letterio;Degano, Pierpaolo;Mühlberg, Jan Tobias;Piessens, Frank",57192711957;55447479800;56912465500;55260418300;7006345611;23009453600;6602153049
10.1007/978-3-030-91631-2_7,1,"We address the problem of a mutual agreement between a bug bounty issuer and a bounty hunter in blockchain smart contracts. Our framework is VeriOSS, where a Proof of Knowledge protocol is used. Through it, the hunter communicates in clear increasingly large portions of the detected bug and gets back increasingly ample portions of the reward, provided that the issuer considers the received information plausible. The process is iterated until the entire bug is revealed and the entire reward given. We formalize this protocol using the Applied Pi-calculus and we apply ProVerif to it so as to verify its correctness, i.e., that only the relevant information and the corresponding reward are exchanged and that the integrity and the authenticity of the communications is granted.","Degano, Pierpaolo;Galletta, Letterio;Gerali, Selene",7006345611;55260418300;57350473400
10.1109/ACCESS.2021.3093952,9,"Cybersecurity education and training are essential prerequisites of achieving a secure and privacy-friendly digital environment. Both professionals and the general public widely acknowledge the need for high-quality university education programs and professional training courses. However, guides, recommendations, practical tools, and good examples that could help institutions design appropriate cybersecurity programs are still missing. In particular, a comprehensive method to identify skills needed by cybersecurity work roles offered on the job market is missing. This paper aims to provide practical tools and strategies to help higher education providers design good cybersecurity curricula. First, we analyze the content of 89 existing study programs worldwide, collect recommendations of renowned institutions within and outside the EU, and provide a comprehensive survey accompanied by a dynamic web application called Education Map. Based on the knowledge about the current state in cybersecurity education, we design the SPARTA Cybersecurity Skills Framework that provides the currently missing link between work roles and required expertise and shows how to develop a curriculum that reflects job market requirements. Finally, we provide a practical tool that implements the framework and helps education and training providers design new study programs and analyze existing ones by considering the requirements of cybersecurity work roles.","Hajny, Jan;Ricci, Sara;Piesarskas, Edmundas;Levillain, Olivier;Galletta, Letterio;De Nicola, Rocco",55504712600;57126826900;57226613181;36906735100;55260418300;7004298169
10.3233/JCS-200017,6,"Firewalls are essential for managing and protecting computer networks. They permit specifying which packets are allowed to enter a network, and also how these packets are modified by IP address translation and port redirection. Configuring a firewall is notoriously hard, and one of the reasons is that it requires using low level, hard to interpret, configuration languages. Equally difficult are policy maintenance and refactoring, as well as porting a configuration from one firewall system to another. To address these issues we introduce a pipeline that assists system administrators in checking if: (i) the intended security policy is actually implemented by a configuration; (ii) two configurations are equivalent; (iii) updates have the desired effect on the firewall behavior; (iv) there are useless or redundant rules; additionally, an administrator can (v) transcompile a configuration into an equivalent one in a different language; and (vi) maintain a configuration using a generic, declarative language that can be compiled into different target languages. The pipeline is based on IFCL, an intermediate firewall language equipped with a formal semantics, and it is implemented in an open source tool called FWS. In particular, the first stage decompiles real firewall configurations for iptables, ipfw, pf and (a subset of) Cisco IOS into IFCL. The second one transforms an IFCL configuration into a logical predicate and uses the Z3 solver to synthesize an abstract specification that succinctly represents the firewall behavior. System administrators can use FWS to analyze the firewall by posing SQL-like queries, and update the configuration to meet the desired security requirements. Finally, the last stage allows for maintaining a configuration by acting directly on its abstract specification and then compiling it to the chosen target language. Tests on real firewall configurations show that FWS can be fruitfully used in real-world scenarios.","Bodei, Chiara;Ceragioli, Lorenzo;Degano, Pierpaolo;Focardi, Riccardo;Galletta, Letterio;Luccio, Flaminia;Tempesta, Mauro;Veronese, Lorenzo",6603107885;57205736407;7006345611;6701345241;55260418300;7005244352;56789732400;56344550600
10.1007/s10817-020-09568-7,0,"Verifying the correctness of a system as a whole requires establishing that it satisfies a global specification. When it does not, it would be helpful to determine which modules are incorrect. As a consequence, specification decomposition is a relevant problem from both a theoretical and practical point of view. Until now, specification decomposition has been independently addressed by the control theory and verification communities through natural projection and partial model checking, respectively. We prove that natural projection reduces to partial model checking and, when cast in a common setting, the two are equivalent. Apart from their foundational interest, our results build a bridge whereby the control theory community can reuse algorithms and results developed by the verification community. Furthermore, we extend the notions of natural projection and partial model checking from finite-state to symbolic transition systems and we show that the equivalence still holds. Symbolic transition systems are more expressive than traditional finite-state transition systems, as they can model large systems, whose behavior depends on the data handled, and not only on the control flow. Finally, we present an algorithm for the partial model checking of both kinds of systems that can be used as an alternative to natural projection.","Costa, Gabriele;Galletta, Letterio;Degano, Pierpaolo;Basin, David;Bodei, Chiara",32067717500;55260418300;7006345611;7003799223;6603107885
10.4204/EPTCS.324.3,5,"Component-based development is challenging in a distributed setting, for starters considering programming a task may involve the assembly of loosely-coupled remote components. In order for the task to be fulfilled, the supporting interaction among components should follow a well-defined protocol. In this paper we address a model for message passing component-based systems where components are assembled together with the protocol itself. Components can therefore be independent from the protocol, and reactive to messages in a flexible way. Our contribution is at the level of the type language that allows to capture component behaviour so as to check its compatibility with a protocol. We show the correspondence of component and type behaviours, which entails a progress property for components.","Savanovic, Zorica;Galletta, Letterio;Vieira, Hugo Torres",57219504601;55260418300;16507952400
10.1109/CSF49147.2020.00026,20,"Computer systems often provide hardware support for isolation mechanisms like privilege levels, virtual memory, or enclaved execution. Over the past years, several successful software-based side-channel attacks have been developed that break, or at least significantly weaken the isolation that these mechanisms offer. Extending a processor with new architectural or micro-architectural features, brings a risk of introducing new such side-channel attacks. This paper studies the problem of extending a processor with new features without weakening the security of the isolation mechanisms that the processor offers. We propose to use full abstraction as a formal criterion for the security of a processor extension, and we instantiate that criterion to the concrete case of extending a microprocessor that supports enclaved execution with secure interruptibility of these enclaves. This is a very relevant instantiation as several recent papers have shown that interruptibility of enclaves leads to a variety of software-based side-channel attacks. We propose a design for interruptible enclaves, and prove that it satisfies our security criterion. We also implement the design on an open-source enclave-enabled microprocessor, and evaluate the cost of our design in terms of performance and hardware size.","Busi, Matteo;Noorman, Job;Bulck, Jo Van;Galletta, Letterio;Degano, Pierpaolo;Muhlberg, Jan Tobias;Piessens, Frank",57192711957;55447479800;57218850988;55260418300;7006345611;23009453600;6602153049
