doi,citedby_count,description,author_names,author_ids
10.1007/978-3-030-49443-8_17,1,"The Internet of Things (IoT) is leading to a smartification of our society: we are surrounded by many smart devices that automatically collect and exchange data of various kinds and provenance. Many of these data are critical because they are used to train learning algorithms, to control cyber-physical systems or to guide administrators to take decisions. Since the collected data are so important, many devices can be the targets of security attacks. Consequently, it is crucial to be able to trace data and to identify their paths inside a network of smart devices to detect possible threats. To help designers in this threat reasoning, we start from the modelling language IoT-LySa, and propose a Control Flow Analysis, a static analysis technique, for predicting the possible trajectories of data in an IoT system. Trajectories can be used as the basis for checking at design time whether sensitive data can pass through possibly dangerous nodes, and for selecting suitable security mechanisms that guarantee a reliable transport of data from sensors to servers using them. The computed paths are also interesting from an architectural point of view for deciding in which nodes data are collected, processed, communicated and stored.","Bodei, Chiara;Galletta, Letterio",6603107885;55260418300
10.1007/978-3-030-50029-0_16,20,"The development of blockchain technologies has enabled the trustless execution of so-called smart contracts, i.e. programs that regulate the exchange of assets (e.g., cryptocurrency) between users. In a decentralized blockchain, the state of smart contracts is collaboratively maintained by a peer-to-peer network of mutually untrusted nodes, which collect from users a set of transactions (representing the required actions on contracts), and execute them in some order. Once this sequence of transactions is appended to the blockchain, the other nodes validate it, re-executing the transactions in the same order. The serial execution of transactions does not take advantage of the multi-core architecture of modern processors, so contributing to limit the throughput. In this paper we propose a true concurrent model of smart contracts execution. Based on this, we show how static analysis of smart contracts can be exploited to parallelize the execution of transactions.","Bartoletti, Massimo;Galletta, Letterio;Murgia, Maurizio",9536042900;55260418300;56426843800
,0,"In a collaborative distributed environment, users own a set of private resources that they possibly share with each other to achieve mutual advantages. The access to resources is regulated by a policy defined by each user in isolation, and independently of the others. However, typical access control languages allow defining policies that only check the roles or the attributes of the requesters and resources. But they do not impose a fair exchange of access grants by taking into account what requesters offer to others. Here, we present MuAC, a logic-based access control language designed for expressing mutuality. In particular, MuAC allows specifying conditions on what requesters must offer in exchange for using a particular resource.","Ceragioli, Lorenzo;Degano, Pierpaolo;Galletta, Letterio",57205736407;7006345611;55260418300
,0,"Obfuscating compilers protect a software by obscuring its meaning and impeding the reconstruction of its original source code. The typical concern when defining such compilers is their robustness against reverse engineering and the performance of the produced code. Little work has been done in studying whether the security properties of a program are preserved under obfuscation. In this paper we start addressing this problem: we consider control-flow flattening, a popular obfuscation technique used in industrial compilers, and a specific security policy, namely constant-time. We prove that this obfuscation preserves the policy, i.e., that every program satisfying the policy still does after the transformation.","Busi, Matteo;Degano, Pierpaolo;Galletta, Letterio",57192711957;7006345611;55260418300
10.1007/978-3-030-41103-9_9,4,"The Internet of Things (IoT) is deeply changing our society. Daily we use smart devices that automatically collect, aggregate and exchange data about our lives. These data are often pivotal when they are used e.g. to train learning algorithms, to control cyber-physical systems, and to guide administrators to take crucial decisions. As a consequence, security attacks on devices can cause severe damages on IoT systems that take care of essential services, such as delivering power, water, transport, and so on. The difficulty of preventing intrusions or attacks is magnified by the big amount of devices and components IoT systems are composed of. Therefore, it is crucial to identify the most critical components in a network of devices and to understand their level of vulnerability, so as to detect where it is better to intervene for improving security. In this paper, we start from the modelling language IoT-LySa and from the results of Control Flow Analysis that statically predict the manipulation of data and their possible trajectories. On this basis, we aim at deriving possible graphs of how data move and which are their dependencies. These graphs can be analysed, by exploiting some security metrics - among which those introduced by Barrere, Hankin et al. - offering system administrators different estimates of the security level of their systems.","Bodei, Chiara;Degano, Pierpaolo;Ferrari, Gian Luigi;Galletta, Letterio",6603107885;7006345611;56221627000;55260418300
10.1007/s11227-018-2603-3,0,"In the times of mobility and pervasiveness of computing, contextual information plays an increasingly crucial role in applications. This kind of information becomes a first class citizen in context-oriented programming (COP) paradigm. COP languages provide primitive constructs for easily writing applications that adapt their behaviour depending on the evolution of their operational environment, namely the context. We present these new constructs, the issues and the challenges that arise, reporting on our recent work on MLCoDa. It is a declarative language specifically designed for adaptation and equipped with a clear formal semantics and analysis tools. We will discuss some experiments done with a preliminary implementation of MLCoDa. Through them we will show how applications and context interactions can be better specified, analysed and controlled.","Bodei, Chiara;Degano, Pierpaolo;Ferrari, Gian Luigi;Galletta, Letterio",6603107885;7006345611;56221627000;55260418300
10.1145/3338504.3357340,2,"Firewalls are a fundamental tool for managing and protecting computer networks. They not only permit specifying which packets are allowed to enter a network, but also how these packets are modified by translating IP addresses and performing port redirection (NAT). Many firewalls systems are available which provide different tools and configuration languages. In contrast with the intuition, the most widespread languages cannot express the same configurations, even when simple filtering and NAT transformations are considered. This paper formally investigates the power of firewall languages of the most used tools in Unix and Linux. In particular, we introduce two kinds of expressivity. The first concerns the ways a packet can be transformed by NAT. According to this criterion iptables is strictly more expressive than ipfw and pf that are equivalent. The second kind is more finer-grained and considers the dependencies among the management of all packets. Our results show that some configurations are expressible in a system, but not in another one. Indeed, iptables is incomparable with the others, and ipfw is more expressive than pf.","Ceragioli, Lorenzo;Degano, Pierpaolo;Galletta, Letterio",57205736407;7006345611;55260418300
10.1016/j.tcs.2018.12.002,18,"More smart objects and more applications on the Internet of Things (IoT) mean more security challenges. In IoT security is crucial but difficult to obtain. On the one hand the usual trade-off between highly secure and usable systems is more impelling than ever; on the other hand security is considered a feature that has a cost often unaffordable. Therefore, IoT designers not only need tools to assess possible risks and to study countermeasures, but also methodologies to estimate their costs. Here, we present a methodology, based on the process calculus IoT-LySa, to infer quantitative measures on evolution of systems. The derived quantitative evaluation is exploited to establish the cost of the possible security countermeasures, in terms of time and energy.","Bodei, Chiara;Chessa, Stefano;Galletta, Letterio",6603107885;6701590804;55260418300
10.5220/0007578305720579,0,"The Internet of Things (IoT) devices access and process large amounts of data. Some of them are sensitive and can become a target for security attacks. As a consequence, it is crucial being able to trace data and to identify their paths. We start from the specification language IoT-LyS a, and propose a Control Flow Analysis for statically predicting possible trajectories of data communicated in an IoT system and, consequently, for checking whether sensitive data can pass through possibly dangerous nodes. Paths are also interesting from an architectural point of view for deciding which are the points where data are collected, processed, communicated and stored and which are the suitable security mechanisms for guaranteeing a reliable transport from the raw data collected by the sensors to the aggregation nodes and to servers that decide actuations.","Bodei, Chiara;Galletta, Letterio",6603107885;55260418300
,0,"Security of software systems is of paramount importance, for both individuals, and the society and its infrastructures. The programs that support our activities must therefore be built robust against attackers. We will briefly survey the methods and the tools offered by programming languages to assist designers and programmers in implementing secure software components. We also discuss the main techniques for verifying the security properties of these components, especially when they are not developed from scratch.","Costa, Gabriele;Degano, Pierpaolo;Galletta, Letterio",32067717500;7006345611;55260418300
10.1007/978-3-030-31500-9_15,25,"The Ethereum platform supports the decentralized execution of smart contracts, i.e. computer programs that transfer digital assets between users. The most common language used to develop these contracts is Solidity, a Javascript-like language which compiles into EVM bytecode, the language actually executed by Ethereum nodes. While much research has addressed the formalisation of the semantics of EVM bytecode, relatively little attention has been devoted to that of Solidity. In this paper we propose a minimal calculus for Solidity contracts, which extends an imperative core with a single primitive to transfer currency and invoke contract procedures. We build upon this formalisation to give semantics to the Ethereum blockchain. We show our calculus expressive enough to reason about some typical quirks of Solidity, like e.g. re-entrancy.","Bartoletti, Massimo;Galletta, Letterio;Murgia, Maurizio",9536042900;55260418300;56426843800
10.1007/978-3-030-31175-9_6,2,"Designing and maintaining firewall configurations is hard, also for expert system administrators. Indeed, policies are made of a large number of rules and are written in low-level configuration languages that are specific to the firewall system in use. As part of a larger group, we have addressed these issues and have proposed a semantic-based transcompilation pipeline. It is supported by FWS, a tool that analyses a real configuration and ports it from a firewall system to another. To our surprise, we discovered that some configurations expressed in a real firewall system cannot be ported to another system, preserving the semantics. Here we outline the main reasons for the detected differences between the firewall languages, and describe F2F, a tool that checks if a given configuration in a system can be ported to another system, and reports its user on which parts cause problems and why.","Ceragioli, Lorenzo;Degano, Pierpaolo;Galletta, Letterio",57205736407;7006345611;55260418300
10.1007/978-3-030-19052-1_6,1,"Security of software systems has to be preserved while they grow and change incrementally. The problem is to make the analysis of their security properties adhere to such a development. In particular we concentrate here on static type systems. Given a non-incremental type system, the algorithm we propose permits using it incrementally, so avoiding to develop new incremental versions of it. As a proof-of-concept we show how our technique permits an incremental checking of non-interference with robust declassification, starting from the classical type system by Myers, Sabelfeld and Zdancewic.","Busi, Matteo;Degano, Pierpaolo;Galletta, Letterio",57192711957;7006345611;55260418300
10.1007/978-3-030-21485-2_24,3,"Klaim (Kernel Language for Agents Interaction and Mobility) has been devised to design distributed applications composed by many components deployed over the nodes of a distributed infrastructure and to offer programmers primitive constructs for communicating, distributing and retrieving data. Data could be sensitive and some nodes could not be secure. As a consequence it is important to track data in their traversal of the network. To this aim, we propose a Control Flow Analysis that over-approximates the behaviour of Klaim processes and tracks how tuple data can move in the network.","Bodei, Chiara;Degano, Pierpaolo;Ferrari, Gian Luigi;Galletta, Letterio",6603107885;7006345611;56221627000;55260418300
10.1007/978-3-030-20652-9_7,5,"Modern languages are equipped with static type checking/inference that helps programmers to keep a clean programming style and to reduce errors. However, the ever-growing size of programs and their continuous evolution require building fast and efficient analysers. A promising solution is incrementality, aiming at only re-typing the diffs, i.e. those parts of the program that change or are inserted, rather than the entire codebase. We propose an algorithmic schema that drives an incremental usage of existing, standard typing algorithms with no changes. Ours is a grey-box approach: just the shape of the input, that of the results and some domain-specific knowledge are needed to instantiate our schema. Here, we present the foundations of our approach and the conditions for its correctness. We show it at work to derive two different incremental typing algorithms. The first type checks an imperative language to detect information flow and non-interference, and the second infers types for a functional language. We assessed our proposal on a prototypical implementation of an incremental type checker. Our experiments show that using the type checker incrementally is (almost) always rewarding.","Busi, Matteo;Degano, Pierpaolo;Galletta, Letterio",57192711957;7006345611;55260418300
10.5220/0007578305720579,4,"The Internet of Things (IoT) devices access and process large amounts of data. Some of them are sensitive and can become a target for security attacks. As a consequence, it is crucial being able to trace data and to identify their paths. We start from the specification language IOT-LYSA, and propose a Control Flow Analysis for statically predicting possible trajectories of data communicated in an IoT system and, consequently, for checking whether sensitive data can pass through possibly dangerous nodes. Paths are also interesting from an architectural point of view for deciding which are the points where data are collected, processed, communicated and stored and which are the suitable security mechanisms for guaranteeing a reliable transport from the raw data collected by the sensors to the aggregation nodes and to servers that decide actuations.","Bodei, Chiara;Galletta, Letterio",6603107885;55260418300
,4,"Designing and maintaining firewall configurations is hard also for expert system administrators. Indeed, policies are made of a large number of rules and are written in low-level configuration languages that are specific to the firewall system in use. To simplify the work of system administrators, some authors of the present paper proposed in previous work a transcompilation pipeline and a tool that (i) extracts the meaning of a real configuration by representing it into a tabular form; (ii) refactors a configuration by removing redundant rules; (iii) ports the policy from a firewall system to another. Here, we extend this pipeline by proposing a new characterization that models rulesets and firewalls as functions from packets to transformations. Transformations specify which packets are accepted by the firewall and how they are translated. Using this functional characterization we propose two new algorithms that simplify the treatment of the pipeline.","Ceragioli, Lorenzo;Galletta, Letterio;Tempesta, Mauro",57205736407;55260418300;56789732400
,2,"Modern programming languages provide helpful high-level abstractions and mechanisms (e.g. types, module, automatic memory management) that enforce good programming practices and are crucial when writing correct and secure code. However, the security guarantees provided by such abstractions are not preserved when a compiler translates a source program into object code. Formally secure compilation is an emerging research field concerned with the design and the implementation of compilers that preserve source-level security properties at the object level. This paper presents a short guided tour of the relevant literature on secure compilation. Our goal is to help newcomers to grasp the basic concepts of this field and, for this reason, we rephrase and present the most relevant results in the literature in a common setting.","Busi, Matteo;Galletta, Letterio",57192711957;55260418300
10.1109/EuroSP.2018.00015,20,"Configuring and maintaining a firewall configuration is notoriously hard. Policies are written in low-level, platform-specific languages where firewall rules are inspected and enforced along non trivial control flow paths. Further difficulties arise from Network Address Translation (NAT), since filters must be implemented with addresses translations in mind. In this work, we study the problem of decompiling a real firewall configuration into an abstract specification. This abstract version throws the low-level details away by exposing the meaning of the configuration, i.e., the allowed connections with possible address translations. The generated specification makes it easier for system administrators to check if: (i) the intended security policy is actually implemented; (ii) two configurations are equivalent; (iii) updates have the desired effect on the firewall behavior. The peculiarity of our approach is that is independent of the specific target firewall system and language. This independence is obtained through a generic intermediate language that provides the typical features of real configuration languages and that separates the specification of the rulesets, determining the destiny of packets, from the specification of the platform-dependent steps needed to elaborate packets. We present a tool that decompiles real firewall configurations from different systems into this intermediate language and uses the Z3 solver to synthesize the abstract specification that succinctly represents the firewall behavior and the NAT. Tests on real configurations show that the tool is effective: it synthesizes complex policies in a matter of minutes and, and it answers to specific queries in just a few seconds. The tool can also point out policy differences before and after configuration updates in a simple, tabular form.","Bodei, Chiara;Degano, Pierpaolo;Galletta, Letterio;Focardi, Riccardo;Tempesta, Mauro;Veronese, Lorenzo",6603107885;7006345611;55260418300;6701345241;56789732400;56344550600
10.1007/978-3-319-89960-2_19,2,"Specification decomposition is a theoretically interesting and practically relevant problem for which two approaches were independently developed by the control theory and verification communities: natural projection and partial model checking. In this paper we show that, under reasonable assumptions, natural projection reduces to partial model checking and, when cast in a common setting, the two are equivalent. Aside from their theoretical interest, our results build a bridge whereby the control theory community can reuse algorithms and results developed by the verification community. In addition, we present an algorithm and a tool for the partial model checking of finite-state automata that can be used as an alternative to natural projection.","Costa, Gabriele;Basin, David;Bodei, Chiara;Degano, Pierpaolo;Galletta, Letterio",32067717500;7003799223;6603107885;7006345611;55260418300
10.1007/978-3-319-89722-6_13,11,"Porting a policy from a firewall system to another is a difficult and error prone task. Indeed, network administrators have to know in detail the policy meaning, as well as the internals of the firewall systems and of their languages. Equally difficult is policy maintenance and refactoring, e.g., removing useless or redundant rules. In this paper, we present a transcompiling pipeline that automatically tackles both problems: it can be used to port a policy into an equivalent one, when the target firewall language is different from the source one; when the two languages coincide, transcompiling supports policy maintenance and refactoring. Our transcompiler and its correctness are based on a formal intermediate firewall language that we endow with a formal semantics.","Bodei, Chiara;Degano, Pierpaolo;Focardi, Riccardo;Galletta, Letterio;Tempesta, Mauro",6603107885;7006345611;6701345241;55260418300;56789732400
10.2424/ASTSN.M.2018.6,4,"The adoption of precision agriculture has been enabled by the arrival of the new ICT technologies included in the wider context of the Internet of Things. We advocate that formal software engineering models and methodologies can provide support to the design of networks for precision agriculture. We propose here the process algebraic framework as a formal support for understanding the possible data-flows for decision-making, once identified from where data are to be gathered. In particular, we exploit IoT-LySa, a recently introduced process calculus, through which we model a possible agriculture scenario. We consider grape cultivation, with particular attention to a careful usage of water. The static analysis developed for IoT-LySa can be used for predicting the interactions among nodes, how data spread from sensors to the network, and how they are manipulated, so helping in water preservation.","Bodei, Chiara;Degano, Pierpaolo;Ferrari, Gian Luigi;Galletta, Letterio",6603107885;7006345611;56221627000;55260418300
,2,"Firewalls are notoriously hard to configure and maintain. Policies are written in low-level, system-specific languages where rules are inspected and enforced along non-trivial control flow paths. Moreover, firewalls are tightly related to Network Address Translation (NAT) since filters need to be specified taking into account the possible translations of packet addresses, further complicating the task of network administrators. To simplify this job, we propose FIRE WALL SYNTHESIZER (FWS), a tool that decompiles real firewall configurations from different systems into an abstract specification. This representation highlights the meaning of a configuration, i.e., the allowed connections with possible address translations. We show the usage of FWS in analyzing and maintaining a configuration on a simple (yet realistic) scenario and we discuss how the tool scales on real-world policies.","Bodei, Chiara;Degano, Pierpaolo;Focardi, Riccardo;Galletta, Letterio;Tempesta, Mauro;Veronese, Lorenzo",6603107885;7006345611;6701345241;55260418300;56789732400;56344550600
10.4204/EPTCS.261.6,1,"The design of IoT systems could benefit from the combination of two different analyses. We perform a first analysis to approximate how data flow across the system components, while the second analysis checks their communication soundness. We show how the combination of these two analyses yields further benefits hardly achievable by separately using each of them. We exploit two independently developed tools for the analyses. Firstly, we specify IoT systems in IoT-LySa, a simple specification language featuring asynchronous multicast communication of tuples. The values carried by the tuples are drawn from a term-algebra obtained by a parametric signature. The analysis of communication soundness is supported by ChorGram, a tool developed to verify the compatibility of communicating finite-state machines. In order to combine the analyses we implement an encoding of IoT-LySa processes into communicating machines. This encoding is not completely straightforward because IoT-LySa has multicast communications with data, while communication machines are based on point-to-point communications where only finitely many symbols can be exchanged. To highlight the benefits of our approach we appeal to a simple yet illustrative example.","Bodei, Chiara;Degano, Pierpaolo;Galletta, Letterio;Tuosto, Emilio",6603107885;7006345611;55260418300;8967981400
